podcast_name,podcast_id,podcast_description,podcast_publisher,podcast_total_episodes,podcast_explicit,podcast_external_url,podcast_image_url,podcast_category,podcast_dominant_color
The Magnus Archives,5pwBAjuJJAOt7cED5Lkjnk,"“Make your statement, face your fear.” A weekly horror fiction podcast examining what lurks in the archives of the Magnus Institute, an organisation dedicated to researching the esoteric and the weird. Join Jonathan Sims as he explores the archive, but be warned, as he looks into its depths something starts to look back… New episodes every Thursday produced by Rusty Quill, featuring guest actors, short stories, serial plots and more. The Magnus Protocol launches in January 2024. Hosted on Acast. See acast.com/privacy for more information.",Rusty Quill,338,True,https://open.spotify.com/show/5pwBAjuJJAOt7cED5Lkjnk,https://i.scdn.co/image/ab6765630000ba8a9293c043dd656fbd79033f88,Arts,"rgb(66, 229, 153)"
The Moth,5UKrcYdaGbq10z97yqi81N,"On Tuesdays and Fridays The Moth’s podcast feed presents episodes of the Peabody-Award Winning Moth Radio Hour and original episodes of The Moth Podcast.Since its launch in 1997, The Moth has presented thousands of true stories, told live and without notes, to standing-room-only crowds worldwide. Moth storytellers stand alone, under a spotlight, with only a microphone and a roomful of strangers. The storyteller and the audience embark on a high-wire act of shared experience which is both terrifying and exhilarating. Since 2008, The Moth podcast has featured many of our favorite stories told live on Moth stages around the country. For information on all of our programs and live events, visit themoth.org.",The Moth,214,False,https://open.spotify.com/show/5UKrcYdaGbq10z97yqi81N,https://i.scdn.co/image/ab6765630000ba8afcccbf35f3cb497ca660b87d,Arts,"rgb(189, 201, 67)"
ASMR by Gibi for Sleep and Relaxation,6MWAkIEDqe8cgQjPvUaW2V,"Gibi ASMR delivers creative, calming content meant to soothe the mind and allow you to drift off to dreamland. ASMR is suitable for relaxing, background audio, sleeping, or satisfying entertainment!",Gibi ASMR,204,False,https://open.spotify.com/show/6MWAkIEDqe8cgQjPvUaW2V,https://i.scdn.co/image/ab6765630000ba8aaaaec8e158bad479829e2ead,Arts,"rgb(121, 61, 215)"
Airrack,30pa4FiXMAtG1z53slrZ25,I’m just a kid with a dream,Airrack,31,False,https://open.spotify.com/show/30pa4FiXMAtG1z53slrZ25,https://i.scdn.co/image/ab6765630000ba8a64e79acce49695b34047c68e,Arts,"rgb(181, 138, 111)"
99% Invisible,2VRS1IJCTn2Nlkg33ZVfkM,"Design is everywhere in our lives, perhaps most importantly in the places where we've just stopped noticing. 99% Invisible is a weekly exploration of the process and power of design and architecture. From award winning producer Roman Mars. Learn more at 99percentinvisible.org.",Roman Mars,695,True,https://open.spotify.com/show/2VRS1IJCTn2Nlkg33ZVfkM,https://i.scdn.co/image/ab6765630000ba8afbd5a0953d90c8d72b19bbbc,Arts,"rgb(244, 221, 53)"
Spooked,76571Rfl3m7PLJQZKQIGCT,"Spooked features true-life supernatural stories, told firsthand by people who can barely believe it happened themselves. Be afraid. Created in the dark of night, by Snap Judgment Studios, in partnership with KQED & PRX. It is hosted by Glynn Washington.Episodes drop every week on Friday! Spooked is available for free on ALL podcast platforms. Featuring brand NEW stories -- along with episodes previously available only by subscription.For Luminary subscribers, previously released episodes are still on Luminary.",Snap Judgment,153,False,https://open.spotify.com/show/76571Rfl3m7PLJQZKQIGCT,https://i.scdn.co/image/ab6765630000ba8a5c75c952e1a6d454722537ff,Arts,"rgb(168, 134, 103)"
Tetragrammaton with Rick Rubin,6ZVBi4NU0OmUT8fPomahis,In-depth interviews that may blow your mind. With Rick Rubin,Rick Rubin,97,True,https://open.spotify.com/show/6ZVBi4NU0OmUT8fPomahis,https://i.scdn.co/image/ab6765630000ba8a5e29b7d016e92630de9ed66d,Arts,"rgb(61, 171, 194)"
Chichi's CDs,24PzTknDMWxNTA2KExjHi5,nsfw audios for all of us!  reminder: please rate low or leave unrated!!  want to request an audio? join my disc! https://discord.gg/UshMzqWE,'Chi,37,True,https://open.spotify.com/show/24PzTknDMWxNTA2KExjHi5,https://i.scdn.co/image/ab6765630000ba8a988e771515ad429637883070,Arts,"rgb(255, 0, 0)"
AudioBook Listners,1nljG0V5RVYqKqyLChOglp,This page have some Spicy Audiobooks so listen at you'r own pace.,A.S.,75,True,https://open.spotify.com/show/1nljG0V5RVYqKqyLChOglp,https://i.scdn.co/image/ab6765630000ba8a95cbbc7808084b28420682a3,Arts,"rgb(255, 0, 0)"
Fresh Air,0HF5T1BVjaUR6dMlAamdB5,"Fresh Air from WHYY, the Peabody Award-winning weekday magazine of contemporary arts and issues, is one of public radio's most popular programs. Hosted by Terry Gross, the show features intimate conversations with today's biggest luminaries.Subscribe to Fresh Air Plus! You'll enjoy bonus episodes and sponsor-free listening - all while you support NPR's mission. Learn more at plus.npr.org/freshairAnd subscribe to our weekly newsletter, Fresh Air Weekly, to get interview highlights, staff recommendations, gems from the archive, and the week's interviews and reviews all in one place. Sign up at www.whyy.org/freshair",NPR,300,False,https://open.spotify.com/show/0HF5T1BVjaUR6dMlAamdB5,https://i.scdn.co/image/ab6765630000ba8a069da8b00fc25043d744243d,Arts,"rgb(37, 166, 233)"
The Jimmy Dore Show,35UZkmSndjvs1zdH2zACFT,"“ Jimmy Dore is outrageous and outraged, bothersome and bothered, a crucial, profane, passionate voice for progressives and freethinkers in 21st century America.” -Patton Oswalt",Jimmy Dore,100,True,https://open.spotify.com/show/35UZkmSndjvs1zdH2zACFT,https://i.scdn.co/image/ab6765630000ba8a0af7b2b0aff6f2404b134709,Arts,"rgb(52, 98, 241)"
Fantasy Fangirls,24KydMMzrYfVpDggkFZx4j,"Two sisters, Nicole and Lexi, dive deep into your favorite fantasy books – talking about lore, characters, insights, and theories of beloved stories. Currently covering A Court of Thorns and Roses by Sarah J. Maas (SPOILERS for the entire ACOTAR series) Every episode, these two sisters cover several chapters of ACOTAR, diving into our Inner Circle Debrief (chapter summaries) before we Step Into The Cauldron with key insights, foreshadowing and theories, then Sip Tea With The Suriel for an in-depth exploration of a lore topic in this fantasy world. New episodes drop every Monday!",Fantasy Fangirls | QCODE,86,True,https://open.spotify.com/show/24KydMMzrYfVpDggkFZx4j,https://i.scdn.co/image/ab6765630000ba8a904d2fb9986f5c5d2a63af80,Arts,"rgb(255, 0, 0)"
Goostarion's CDs ,6JHMU0dQAbigeumsuUstUg,16+   ***I do not own the audios I post; they rightfully belong to the creators I credit to in the descriptions!***  **Please do not rate the podcast!!! It helps out with not being taken down by spotify!!!**  I am 19 yrs old. I am genderfluid (she/he/they) and aroace (asexual and romantic). I am currently in college so I will not post often due to that.  Team member: issa  Discord Server:  https://discord.gg/sS66XgH2bv  Newly created playlist I made:  https://open.spotify.com/playlist/1uHXyFB4gW1hcAChRcfnfx?si=UsK_YYaRSKOQYR7n9hu0uQ&pi=D4Fo6oJUQqiPm,Goostarion (GOO GOOBIE :3),110,True,https://open.spotify.com/show/6JHMU0dQAbigeumsuUstUg,https://i.scdn.co/image/ab6765630000ba8a930f57d4974360da4ba5a9d4,Arts,"rgb(218, 85, 81)"
stella uploads stuff,6uiDuuPuX6ph6gjwMeIGeA,so basically my podcast got taken down 😭😭 formerly 'i post yt videos'  so yeahh this is my new podcast n we'll see how long this one lasts !! i take requests !!!,stellaaaaa,341,True,https://open.spotify.com/show/6uiDuuPuX6ph6gjwMeIGeA,https://i.scdn.co/image/ab6765630000ba8a0aa620dcb0276e2a70f94a72,Arts,"rgb(255, 0, 0)"
The summer I turned pretty audiobook,7p9uRph4UwLekGkdU1ib90,The summer I turned pretty audiobook narrated by Lola Tung,Caitlyn💋,3,False,https://open.spotify.com/show/7p9uRph4UwLekGkdU1ib90,https://i.scdn.co/image/ab6765630000ba8a9781694ca06f0c9965d38a73,Arts,"rgb(200, 113, 83)"
Angel's bookshelf ,6LcH7DZdRSNYv6Hj1PZtQz,ANGEL'S BOOKSTORE GOT REMOVED 🙁💔  Uploads almost everyday‼️  RATE LOW OR DON'T RATE AT ALL‼️  Cover: Sua from alien stage  Discord server: https://discord.gg/Cng69d4g  3rd podcast!,ANGEL,64,True,https://open.spotify.com/show/6LcH7DZdRSNYv6Hj1PZtQz,https://i.scdn.co/image/ab6765630000ba8af30c7566594ca4086b396351,Arts,"rgb(255, 0, 0)"
Fashion Neurosis with Bella Freud ,5u12Pe78N9yaQWRWWoXZTK,"Each week join the renowned fashion designer Bella Freud as she invites a special guest to ‘lie on the couch’ and explore the connection between fashion and identity. Bella’s conversations begin with questions about style and what we reveal through the clothes we wear. Bella also shares her own anecdotes and the conversations expand into deeper discussions on life’s universal themes—love, identity, culture, anxiousness, and even politics.Through a series of tailored questions, Bella creates a relaxed, intimate atmosphere where her guests—ranging from fashion icons to cultural figures in sport, art, music and literature reveal more about themselves than they might expect. Fashion is often dismissed as superficial, but in this podcast, it becomes the lens through which we examine our inner lives, relationships, and society.From Kate Moss to other notable guests, Fashion Neurosis with Bella Freud offers a unique, thoughtful, and engaging conversation that goes far beyond what we wear: diving into the unspoken language of clothing and the ways in which we use style to navigate and communicate in the world.www.fashionneurosis.com@fashionnueorsis_bellafreud",Bella Freud,11,False,https://open.spotify.com/show/5u12Pe78N9yaQWRWWoXZTK,https://i.scdn.co/image/ab6765630000ba8a8b5c6cfe618ecda491c6aa62,Arts,"rgb(255, 0, 0)"
audiobooks 📚,4GgcSiour2omTQCfB49rgB,"Hey y’all! I’m KatReads 💗 Comment to suggest any books // fanfics 🫶 I post every Thursday, I also double post often :) Link tree to my YT and Instagram are linked! 📚 Most of my audios are 18+ ‼️",Kat Reads,43,True,https://open.spotify.com/show/4GgcSiour2omTQCfB49rgB,https://i.scdn.co/image/ab6765630000ba8afeaf61b043b1dbe2b4d5db9f,Arts,"rgb(159, 97, 109)"
Something Scary,3IhUqegzY0g0PJJPaoQdYS,"Something Scary is a horror podcast that brings listeners ghost stories, urban legends, and folktales from around the world. Hosted by Blair Bathory, the podcast features spine-chilling tales that explore the supernatural, from hauntings to strange encounters and gripping mysteries. Each week, they delve into the unknown, offering eerie narratives that are sure to leave you feeling unsettled. If you’re a fan of bone-chilling storytelling and unexplained phenomena, Something Scary is your go-to for all things spooky. Wanna hear something scary without ads? Click here: https://somethingscary.supercast.tech/ We wanna make the podcast even better, help us learn how we can: https://bit.ly/2EcYbu4  For advertising opportunities please email PodcastPartnerships@Studio71us.com    Privacy Policy: https://www.studio71.com/us/terms-and-conditions-use/#Privacy%20Policy",Studio71,323,True,https://open.spotify.com/show/3IhUqegzY0g0PJJPaoQdYS,https://i.scdn.co/image/ab6765630000ba8a0ace74d94173d67363467b82,Arts,"rgb(185, 119, 115)"
Kay's CDs.,2bRBSXEqBDwhkPLYS0G9Xr,discord : kommzz server : https://discord.gg/vX4caGUb rate lowwww,' Kay .,59,False,https://open.spotify.com/show/2bRBSXEqBDwhkPLYS0G9Xr,https://i.scdn.co/image/ab6765630000ba8afd07d6db4cdd6b874036d7a7,Arts,"rgb(255, 0, 0)"
Gastropod,2bB44RWKrgs1jhylH1NBtL,"Food with a side of science and history. Every other week, co-hosts Cynthia Graber and Nicola Twilley serve up a brand new episode exploring the hidden history and surprising science behind a different food- or farming-related topic, from aquaculture to ancient feasts, from cutlery to chile peppers, and from microbes to Malbec. We interview experts, visit labs, fields, and archaeological digs, and generally have lots of fun while discovering new ways to think about and understand the world through food. Find us online at gastropod.com, follow us on Twitter @gastropodcast, and like us on Facebook at facebook.com/gastropodcast.",Cynthia Graber and Nicola Twilley,252,False,https://open.spotify.com/show/2bB44RWKrgs1jhylH1NBtL,https://i.scdn.co/image/ab6765630000ba8a49d4ee52e8e9d09e4678196b,Arts,"rgb(172, 185, 98)"
The Emerald,1OwFblqZ7FIkLSW4rvbJEF,"The Emerald explores the human experience through a vibrant lens of myth, story, and imagination. Brought to life through the wise, wild, and humorous vision of Joshua Michael Schrei — a teacher and lifelong student of the cosmologies and mythologies of the world — the podcast draws from a deep well of poetry, lore, and mythos to challenge conventional narratives on politics and public discourse, meditation and mindfulness, art, science, literature, and more. At the heart of the podcast is the premise that the imaginative, poetic, animate heart of human experience — elucidated by so many cultures over so many thousands of years — is missing in modern discourse and is urgently needed at a time when humanity is facing unprecedented problems. The Emerald advocates for an imaginative vision of human life and human discourse as it questions deep underlying assumptions about societal progress.",Joshua Schrei ,88,True,https://open.spotify.com/show/1OwFblqZ7FIkLSW4rvbJEF,https://i.scdn.co/image/ab6765630000ba8ad65fb7375f1c1420076314ab,Arts,"rgb(63, 207, 88)"
Myths and Legends,6xqETOvGnSQHH0xdLtgcXU,"Jason Weiser and Carissa Weiser tell stories from myths, legends, and folklore that have shaped cultures throughout history. Some, like the stories of Aladdin, King Arthur, and Hercules are stories you think you know, but with surprising origins. Others are stories you might not have heard, but really should. All the stories are sourced from world folklore, but retold for modern ears. These are stories of wizards, knights, Vikings, dragons, princesses, and kings from the time when the world beyond the map was a dangerous and wonderful place.","Jason Weiser, Carissa Weiser, Nextpod",492,False,https://open.spotify.com/show/6xqETOvGnSQHH0xdLtgcXU,https://i.scdn.co/image/ab6765630000ba8a2a538dd64ed7c92cb8f84ee2,Arts,"rgb(166, 124, 99)"
Snap Judgment,3Cct7ZWmxHNAtLgBTqjC5v,"Snap Judgment mixes real stories with killer beats to produce cinematic, dramatic radio. Snap’s raw, musical brand of storytelling dares listeners to see the world through the eyes of another. It's storytelling... with a BEAT.",Snap Judgment and PRX,440,True,https://open.spotify.com/show/3Cct7ZWmxHNAtLgBTqjC5v,https://i.scdn.co/image/ab6765630000ba8a513530c93e5722ae3ed1ee37,Arts,"rgb(255, 0, 0)"
Be My Guest with Ina Garten,4kokIA880g2ZpJOtcJzfYw,"Join the party as Ina Garten invites friends old and new into her East Hampton home for good food and great conversation. With personal stories shared over cocktails and favorite recipes, each podcast episode features direct audio and exclusive, extended interviews from Be My Guest with Ina Garten, her multi-platform series for Warner Bros. Discovery. Hosted on Acast. See acast.com/privacy for more information.",Food Network,28,False,https://open.spotify.com/show/4kokIA880g2ZpJOtcJzfYw,https://i.scdn.co/image/ab6765630000ba8a6a4e24c58a35258f1fa6d4f9,Arts,"rgb(215, 151, 119)"
Classic Audiobook Collection,0bYkBpWrkqU42rzYR6o0ri,"Explore over a thousand great books by authors from the ancient world through to the twentieth century. From Jane Austen to Herman Melville to Sun Tzu, from the ancient Greeks to American modernists: If a book changed the world, it's here. Share these full-length audiobooks with friends and start an audiobook club!",Classic Literature,1560,False,https://open.spotify.com/show/0bYkBpWrkqU42rzYR6o0ri,https://i.scdn.co/image/ab6765630000ba8ae377566ba3aa4a37bbc70049,Arts,"rgb(224, 135, 103)"
Breaking Bread with Tom Papa,07iR1tmQtqLnfUyk2PB26k,"Comedian and bread baker, Tom Papa, is the perfect host, inviting guests to join himfor an hour of eating, drinking and enjoying life. Listeners are invited to take a seatat the table as Tom and his guests celebrate the true meaning of breaking bread withinsightful, revealing and always funny conversations. ",All Things Comedy,242,True,https://open.spotify.com/show/07iR1tmQtqLnfUyk2PB26k,https://i.scdn.co/image/ab6765630000ba8a96478c573adb6413f180d2a1,Arts,"rgb(248, 89, 122)"
The Splendid Table: Conversations & Recipes For Curious Cooks & Eaters,3DgIWbgSloSKZ1Tr929oeq,"The Splendid Table has always connected people through the common language of food and eating. Now with award-winning food journalist Francis Lam at the helm, we’re bringing forward even more fresh voices and surprising conversations at the intersection of food, people and culture – covering everything from the global appeal of sesame to the impact of Instagram on everyday eating. It’s a food show where everyone is welcome. Produced by American Public Media. Part of the Vox Media Podcast Network",American Public Media,25,False,https://open.spotify.com/show/3DgIWbgSloSKZ1Tr929oeq,https://i.scdn.co/image/ab6765630000ba8a3b7b5441dd585e28628b5623,Arts,"rgb(226, 43, 46)"
audiobooks 📚,4GgcSiour2omTQCfB49rgB,"Hey y’all! I’m KatReads 💗 Comment to suggest any books // fanfics 🫶 I post every Thursday, I also double post often :) Link tree to my YT and Instagram are linked! 📚 Most of my audios are 18+ ‼️",Kat Reads,43,True,https://open.spotify.com/show/4GgcSiour2omTQCfB49rgB,https://i.scdn.co/image/ab6765630000ba8afeaf61b043b1dbe2b4d5db9f,Arts,"rgb(159, 97, 109)"
The Recipe with Kenji and Deb,3Ll536l6jMVQ0c1bZWqbDm,"Hi, we’re Deb Perelman (Smitten Kitchen) and J. Kenji López-Alt (Serious Eats, The Food Lab, The Wok). We’re professional home cooks, which means we can - and will - make the same meal 57 times in a row on the quest for the perfect recipe. Is it crazy? For us, no, because we do this for a living. But for you? Yes, probably. Which is why you should listen to The Recipe with Kenji and Deb. You'll hear us talk about what goes into writing our recipes — the techniques we test, the ingredients we taste — so that you can be on your way to creating your own perfect recipe. Whether you're cooking meatloaf, pancakes, or chicken soup in all its forms, we got you, and you've got this.The Recipe with Kenji and Deb is a proud member of Radiotopia from PRX, a network of independent and listener-supported podcasts. Discover audio with vision at radiotopia.fm.",Deb Perelman & J. Kenji López-Alt,23,True,https://open.spotify.com/show/3Ll536l6jMVQ0c1bZWqbDm,https://i.scdn.co/image/ab6765630000ba8acf5b7a17cbf5157585bb5bb4,Arts,"rgb(99, 201, 212)"
Outside Voices Podcast,6DBGP4DpXQF7zpbTSgqLFu,Welcome to the Outside Voices Podcast,Outside Voices Pod,2,False,https://open.spotify.com/show/6DBGP4DpXQF7zpbTSgqLFu,https://i.scdn.co/image/ab6765630000ba8a2ffdd021b2d0e8630976b56f,Arts,"rgb(19, 185, 241)"
Percy Jackson and the Tales of Olympus,5gI5suDMzQaXqtsrhQeCku,"A reading of the Percy Jackson series written by Rick Riordan. All rights go to Rick Riordan, the author. For updates, follow my Instagram @mirandagkreads thank you for stopping by! Love you guys! Support this podcast: https://creators.spotify.com/pod/show/mirandagk/support",mirandagk,78,False,https://open.spotify.com/show/5gI5suDMzQaXqtsrhQeCku,https://i.scdn.co/image/ab6765630000ba8a073dd62042eabb7c53259e84,Arts,"rgb(214, 199, 121)"
Chosti 2.0,3K0KOwZ9OiFML5E9P4dvEZ,im back yeesss,💤,16,True,https://open.spotify.com/show/3K0KOwZ9OiFML5E9P4dvEZ,https://i.scdn.co/image/ab6765630000ba8a8a93fdc868f4a4e24387ee7b,Arts,"rgb(255, 0, 0)"
True scary stories 2,37ab96rNR0wPeHprZqRuXB,"If you enjoy scary stories as much as I do, then this is the place for you! Join me every night for new True scary stories that are sure to creep you out, and don't forget to press the bell icon for good measure!",True scary stories 2,31,False,https://open.spotify.com/show/37ab96rNR0wPeHprZqRuXB,https://i.scdn.co/image/ab6765630000ba8a11bb5689ae73d12c512f6600,Arts,"rgb(81, 137, 187)"
Engween ,4Stw6UjhEkpOXTG99BsvUB,Engween: A Reddit and reaction channel that sounds just like Tagswag  FOR BUSINESS INQUIRES ONLY: engween@moreyellow.com  DISCLAIMER: The engween channel is all satire and jokes and should not be taken seriously please DO NOT harass anyone mentioned in videos it is uncalled for,Engween,10,False,https://open.spotify.com/show/4Stw6UjhEkpOXTG99BsvUB,https://i.scdn.co/image/ab6765630000ba8adb786a82669b2395db963dbd,Arts,"rgb(241, 119, 87)"
Manacled Audiobook | Audio Dinos + Audiobook Warriors,7AqtWVRrnUR3t5rM6eVZRR,"The Audiobook of The Manacled Fanfiction by Senlinyu.  Support my work, buy me a coffee :) - https://ko-fi.com/thenooblifer  Harry Potter is dead. In the aftermath of the war, in order to strengthen the might of the magical world, Voldemort enacts a repopulation effort. Hermione Granger has an Order secret, lost but hidden in her mind, so she is sent as an enslaved surrogate to the High Reeve, to be bred and monitored until her mind can be cracked.  Tumblr - thenooblifer , Insta - AudioDinos",The Nooblifer,56,True,https://open.spotify.com/show/7AqtWVRrnUR3t5rM6eVZRR,https://i.scdn.co/image/ab6765630000ba8aef9ad8355b1740b89e2eb9b3,Arts,"rgb(221, 57, 41)"
HopeScope on Spotify: 2.0!,2XJOcvrRZhEvp8zIhEr2q8,Hey guys❤️,sophiee (taylors version),1,False,https://open.spotify.com/show/2XJOcvrRZhEvp8zIhEr2q8,https://i.scdn.co/image/ab6765630000ba8a6ae421ade1e36c2b3a5386cb,Arts,"rgb(214, 70, 102)"
LeVar Burton Reads,21yjAjzYXD1xCNDad4OdTV,"The best short fiction, handpicked by the best voice in podcasting and presented in 3D immersive audio. In every episode, host LeVar Burton (Roots, Reading Rainbow, Star Trek) invites you to take a break from your daily life, and dive into a great story. LeVar’s narration blends with gorgeous soundscapes to bring stories by Stephen King, Toni Morrison, Nnedi Okorafor, Kurt Vonnegut, Ken Liu and more to life. So, if you’re ready, let’s take a deep breath...  Our immersive audio is best with headphones! If you'd prefer to listen without immersive audio, visit levarburtonpodcast.com/mono.",LeVar Burton and Stitcher,194,True,https://open.spotify.com/show/21yjAjzYXD1xCNDad4OdTV,https://i.scdn.co/image/ab6765630000ba8a4086ec3c56c21df64ccc9f82,Arts,"rgb(204, 140, 109)"
The Jeselnik & Rosenthal Vanity Project,1lRXvcBK3WH7NacT5qwAPe,"Anthony Jeselnik is a world famous comedian, Gregg Rosenthal is an analyst for NFL Network and they have been best friends for over 20 years. Each week, JRVP features stories from their lives, deep dives into the darkest and craziest news stories from around the world and essential recommendations to their listeners. The hilarious podcast is about friendship, family and Anthony's unquenchable desire to get Gregg in trouble with his employer and his wife.",All Things Comedy,252,True,https://open.spotify.com/show/1lRXvcBK3WH7NacT5qwAPe,https://i.scdn.co/image/ab6765630000ba8a939c22bbaf4fa2ec71db9857,Arts,"rgb(209, 73, 88)"
MrCreepyPasta's Storytime,0smDmHOI9OND09y8cVoq2U,"The OFFICIAL MrCreepyPasta Storytime!Hey there kids! It's me, MrCreepyPasta! And I think I might have found a new way to bring Creepypasta stories from the deep dark stones of the crypt and right to the ear balls in your head. If you're as excited as I am to hear a good story of terror and fear as I am then give me a subscription, hide under your blanket, and prepare yourself for some sweet dreams. Creepypasta Storytime is a collection of some of the most horrifying (and occasionally funny) stories, or Creepypastas, that the internet has to offer and narrated to you by the Blue Man himself. The podcast is taken directly from the YouTube channel of the same name and is always open to suggestions for new stories and submissions from you. mrcreepypasta@gmail.comSupport the podcast here: https://patreon.com/mrcreepypastaBecome a supporter of this podcast: https://www.spreaker.com/podcast/mrcreepypasta-s-storytime--4244348/support.",MrCreepyPasta,1000,True,https://open.spotify.com/show/0smDmHOI9OND09y8cVoq2U,https://i.scdn.co/image/ab6765630000ba8ac8b09e56822874b22c7d88f9,Arts,"rgb(224, 96, 152)"
Pastora Yesenia Then,47SvLma45kOiCjWgO25eRU,"Esposa, Madre, Pastora y Escritora.",Pastora Yesenia Then,510,False,https://open.spotify.com/show/47SvLma45kOiCjWgO25eRU,https://i.scdn.co/image/ab6765630000ba8a468a4666ce7520bf749b0447,Arts,"rgb(255, 0, 0)"
Ryers Readers,6siiIHbnLRPB8HW7pAiu4X,"Let’s do this! I aim to increase listening skills & comprehension in our little ones; as well as give parents an opportunity to enjoy a cup of coffee while it’s still hot!   Looking for even more fun!? Join me on the Ryers Readers Patreon Page where you can find AD-FREE episodes, bonus content, and even become a Ryers Readers Celebrity! Patreon.com/ryersreaders   Instagram @ryersreaders  RYERS20 for 20% off at www.thatdoughtho.com ThatDoughTho Play Dough & Sensory Shop Leading Creative Play Through Sight, Scent, & Touch IG @that.dough.tho Support this podcast: https://creators.spotify.com/pod/show/ryersreaders/support",Ashley,312,False,https://open.spotify.com/show/6siiIHbnLRPB8HW7pAiu4X,https://i.scdn.co/image/ab6765630000ba8a90c00e4e953fb8e4c6764493,Arts,"rgb(80, 193, 196)"
Twenty Thousand Hertz,4E8CLD9KUvrwNPjTP4WGrf,The stories behind the world's most recognizable and interesting sounds.,Dallas Taylor,205,False,https://open.spotify.com/show/4E8CLD9KUvrwNPjTP4WGrf,https://i.scdn.co/image/ab6765630000ba8a3e1c8b9184ccbd00bdebc84c,Arts,"rgb(184, 100, 245)"
