podcast_name,podcast_id,podcast_description,podcast_publisher,podcast_total_episodes,podcast_explicit,podcast_external_url,podcast_image_url,podcast_category,podcast_dominant_color
Drink Champs,1CtRqrNGqpAttWyft6nVss,"Legendary Queens rapper-turned show host N.O.R.E. teams up with Miami hip-hop pioneer DJ EFN for a night of boozy conversation and boisterous storytelling. The hosts and guests engage together in fun, light-hearted conversation - looking back at their paths to success, highlighting their lives, friendships, and iconic moments within their career. In this unfiltered series, drinks are flowing and jokes are rolling - take a seat at the table with N.O.R.E & EFN. You Gotta Relax!",The Black Effect and iHeartPodcasts,451,True,https://open.spotify.com/show/1CtRqrNGqpAttWyft6nVss,https://i.scdn.co/image/ab6765630000ba8a74f949dae8322d11dba3c0f9,Music,"rgb(233, 209, 52)"
Lost Notes: Groupies,7mwisoVVp4UTqxvDq1zePg,This season on Lost Notes: Groupies. Women of the Sunset Strip from the Pill to Punk. From KCRW and Golden Teapot.,KCRW,70,True,https://open.spotify.com/show/7mwisoVVp4UTqxvDq1zePg,https://i.scdn.co/image/ab6765630000ba8aa35e9aafcda1e38d416e8768,Music,"rgb(194, 166, 63)"
ZonaVIPradio,7ulNqDSzORoyzF1FNNtiz7,Entrevistas Musicales - Musica - Comedia Support this podcast: https://podcasters.spotify.com/pod/show/zonavipradio/support,"Salvador Aboytes ""El Compa S""",520,False,https://open.spotify.com/show/7ulNqDSzORoyzF1FNNtiz7,https://i.scdn.co/image/ab6765630000ba8ac1bc47cda1e2800db6bf665e,Music,"rgb(232, 96, 32)"
Billions Club: The Series,0EwDk36KVbO6d6Rbjacf4Z,"Billions Club: The Series is Spotify’s original video series celebrating artists as they reach the milestone of 1 billion streams on a single track. In each episode, artists receive their Billions Club plaques and reflect on the stories behind their biggest hits. Whether sharing personal memories or engaging in creative activities tied to their music, the series gives fans an intimate look into the moments that made these tracks iconic. Billions Club: The Series highlights the powerful connection between artists, their music, and the fans who helped them achieve this incredible milestone.",Spotify Studios,2,True,https://open.spotify.com/show/0EwDk36KVbO6d6Rbjacf4Z,https://i.scdn.co/image/ab6765630000ba8a467ed87c8b7ed76d7d990ca8,Music,"rgb(255, 0, 0)"
Music Student 101,2i0z3AaD1LuuDBxx8HM7wg,A music education podcast,Burns/Phillips,140,False,https://open.spotify.com/show/2i0z3AaD1LuuDBxx8HM7wg,https://i.scdn.co/image/ab6765630000ba8a903b57d6d48ad75c8e67d488,Music,"rgb(255, 0, 0)"
No Jumper,4z4yCTjwXa4an6sBGIe7m5,The Coolest Podcast In The World. Hosted by Adam22 Watch these interviews on YouTube right here: https://www.youtube.com/nojumper,No Jumper,2014,False,https://open.spotify.com/show/4z4yCTjwXa4an6sBGIe7m5,https://i.scdn.co/image/ab6765630000ba8afe4362c29eb9bbcbb6ae3766,Music,"rgb(234, 68, 36)"
"Broken Record with Rick Rubin, Malcolm Gladwell, Bruce Headlam and Justin Richmond",6UsuhRMTD9O71DznRP8540,"From Rick Rubin, Malcolm Gladwell, Bruce Headlam, and Justin Richmond. The musicians you love talk about their life, inspiration, and craft. Then play. iHeartMedia is the exclusive podcast partner of Pushkin Industries.",Pushkin Industries,308,True,https://open.spotify.com/show/6UsuhRMTD9O71DznRP8540,https://i.scdn.co/image/ab6765630000ba8a87222b0af15f42f379b60784,Music,"rgb(255, 0, 0)"
karo's laughable audios (haikyuu x listener) (anime x listener) (original audios by YY/Yagami yato),26QYoFS5bJJkzrwtk3gUIv,Uhm. They found me. ☹️ ANNYWAYSY IM BACK TO UPLOAIDNG LETS GO 💪💪💪💪💪 Hope you guys find me again nothing has changed except the fact ill try to upload more often because. Ive realized ive been taking breaks for 2+ weeks not realising i havent been uploading for so long so if you are desprerate for audios DO comment and tell me to upload 👍   Discord server: https://discord.gg/PGHDmmeF We are very friendly and welcoming pls join!  alsooo uhhh if you WANNA you can follow my socials not self promo haha....  tiktok: kuroosactualgf insta: kuroosrealgf discord if you want: kurootetsuros,kuroosrealgf,64,False,https://open.spotify.com/show/26QYoFS5bJJkzrwtk3gUIv,https://i.scdn.co/image/ab6765630000ba8a592cff82b088c4ae953bd1a5,Music,"rgb(255, 0, 0)"
The Akademy,6pYA7xSkQ8T7v3oAp60Jl4,"Podcasts, Streams and such from DJ Akademiks and crew.",The Akademy,107,True,https://open.spotify.com/show/6pYA7xSkQ8T7v3oAp60Jl4,https://i.scdn.co/image/ab6765630000ba8aee6d0190abf2e667e9ced17c,Music,"rgb(173, 133, 106)"
Evolution of a Snake: The Taylor Swift Podcast,70xT4aA9FayuPmrRAbMrSn,"A podcast detailing the life and times of the world's most famous reptile: Taylor Swift. Hosted by two longtime fans unafraid to critique, Evolution of a Snake takes an analytical lens to the twists and turns of the most eventful pop legacy in recent memory. Diving into the minutiae of each era, the podcast unveils and pays homage to the evolution of a musically proficient cobra. Weekly bonus episodes on Patreon: https://www.patreon.com/swiftologist For advertising opportunities please email PodcastPartnerships@Studio71us.com    We want to make the podcast even better, help us learn how we can: https://bit.ly/2EcYbu4   Privacy Policy: https://www.studio71.com/terms-and-conditions-use/#Privacy%20Policy   ",The Snakes & Studio71,69,True,https://open.spotify.com/show/70xT4aA9FayuPmrRAbMrSn,https://i.scdn.co/image/ab6765630000ba8ab7a2e7476552219fc0aec844,Music,"rgb(211, 69, 58)"
Switched on Pop,1sgWaKtQxwfjUpZnnK8r7J,A podcast all about the making and meaning of popular music. Musicologist Nate Sloan & songwriter Charlie Harding pull back the curtain on how pop hits work magic on our ears & our culture. From Vulture and the Vox Media Podcast Network.,Vulture,441,False,https://open.spotify.com/show/1sgWaKtQxwfjUpZnnK8r7J,https://i.scdn.co/image/ab6765630000ba8a810fca4e5fe9cd513c1b00c6,Music,"rgb(250, 114, 235)"
GOOD OL' GRATEFUL DEADCAST,6Jzbtj0r3sPiNWsPSkjrOR,"“The Good Ol’ Grateful Deadcast,” the official Grateful Dead podcast, is a series devoted to exploring the music and mythology behind one of the most enduring, progressive, and influential bands in the history of recorded music. The podcast’s tagline is “For The Committed And The Curious,” as episodes will invite new fans to explore the band’s enormous mythology in digestible chunks and enlighten life-long Dead Heads about corners of the band’s history they never knew existed. No topic will be off limits on “The Good Ol’ Grateful Deadcast” as hosts Rich Mahan and Jesse Jarnow explore the band’s outrageous history, innovations, and impact from 1965 to today.",Grateful Dead,106,False,https://open.spotify.com/show/6Jzbtj0r3sPiNWsPSkjrOR,https://i.scdn.co/image/ab6765630000ba8acd9161a4cab11fee0aa1cf8c,Music,"rgb(239, 25, 58)"
Dolly Parton's America,0dfJjJyNxF9iW7zmBtLnBf,"In this intensely divided moment, one of the few things everyone still seems to agree on is Dolly Parton—but why? That simple question leads to a deeply personal, historical, and musical rethinking of one of America’s great icons. Join us for a 9-episode journey into the Dollyverse. Hosted by Jad Abumrad. Produced and reported by Shima Oliaee. Dolly Parton’s America is a production from OSM Audio and WNYC Studios.",WNYC Studios & OSM Audio,13,False,https://open.spotify.com/show/0dfJjJyNxF9iW7zmBtLnBf,https://i.scdn.co/image/ab6765630000ba8aacaf5bee421a2f07e5eeadeb,Music,"rgb(221, 36, 67)"
Million Dollaz Worth Of Game,2pBM5JEmMJ4DE7xddtXdZm,"The Million Dollaz Worth of Game show, a weekly podcast with rapper/actor @GillieDaKing and social media influencer and disruptor @Wallo267 - The perfect blend of discussing music, real life issues, personal experiences, honest advice and comedyYou can find every episode of this show on Apple Podcasts, Spotify or YouTube. Prime Members can listen ad-free on Amazon Music. For more, visit barstool.link/mworthofgame",Barstool Sports,317,True,https://open.spotify.com/show/2pBM5JEmMJ4DE7xddtXdZm,https://i.scdn.co/image/ab6765630000ba8ab1dc55b2092f690872227d0e,Music,"rgb(193, 77, 69)"
Celebrity Jobber Podcast with Jeff Zito,2iWxU2DlPmGPk4b02EJPDI,"The word “jobber” is defined in popular culture as somewhat of a journeyman. The movie Rocky tells the story of a boxing jobber, who defies the odds to become the world heavyweight champion. Talk radio veteran Jeff Zito speaks with celebrities about their first job. If not for their big break, what would they have become? Were they destined to be rich and famous? Or were they almost a jobber?",Podcast Playground,116,False,https://open.spotify.com/show/2iWxU2DlPmGPk4b02EJPDI,https://i.scdn.co/image/ab6765630000ba8a6acb3e48ef57f303f6a1cf35,Music,"rgb(234, 204, 147)"
Hark! The stories behind our favorite Christmas carols,5wyxnFiq9x5cnTRLCboMWv,"It’s the most wonderful time of the year! The cookies, the mistletoe, the lights...oh, and the music! For Christians, Christmas carols mark a season of hope and the celebration of Jesus’ birth. Even in popular culture, these iconic jingles capture a warmth, a cheer and a nostalgia that transcends religious belonging.But where do these beloved yuletide songs come from? What inspired the people who composed them? How did they become popular and even mainstream? And what impact do their ancient Christian messages have on an increasingly post-Christian culture?America Media presents “Hark!” a podcast on the meaning and the making of our most beloved Christmas carols and their time-honored traditions. ",America Media,18,False,https://open.spotify.com/show/5wyxnFiq9x5cnTRLCboMWv,https://i.scdn.co/image/ab6765630000ba8af1b9177eb0252dacd95ae9c4,Music,"rgb(219, 144, 146)"
Dem Vinyl Boyz,0nOjEXuDGw2f8K5p8D35et,"For decades, people who enjoyed music on vinyl records instead of CDs or MP3s were considered dinosaurs. While we like moving at 33 RPM, the rest of the world rushed and went to digital. Not only did vinyl refuse to die but demand is at its highest since at least 1991. It's a good thing Dem Vinyl Boyz saved all their records from back in the day. Because, now we have the biggest collection of 12-inch records on the radio.  Dem Vinyl Boyz love the joy of sliding a classic album out of its cover; the crackle of a needle just dropped into a groove; the careful way to pick up and flip a record when a side ends. On the podcast each week we feature a different piece of music history on vinyl record. Dem Vinyl Boyz experience the album front and back, giving you commentary and music facts along the way. Put your ear buds in and let us take you on a musically journey listening to the greatest music of all time and the history of how it became legendary. Dem Vinyl Boyz! Respect The Technique",Podcast Playground,116,False,https://open.spotify.com/show/0nOjEXuDGw2f8K5p8D35et,https://i.scdn.co/image/ab6765630000ba8a800ddaf7e785590c69bafea6,Music,"rgb(212, 83, 58)"
American Railroad,5qn1n7LvaLet6AGbWvaEc5,"Embark on ""American Railroad,"" a five-episode podcast that seeks to highlight the untold stories and unheard voices from the diverse communities that built America’s railway systems. Hosted by Grammy Award-winning musician and Silkroad Artistic Director Rhiannon Giddens, American Railroad is produced in partnership with PRX.  Silkroad, founded by Yo-Yo Ma in 1998, was inspired by the historical Silk Road and created as a model for cultural collaboration through music. In 2020, Rhiannon Giddens was named Artistic Director and immediately embarked on a mission to unearth the forgotten stories of America. Silkroad’s American Railroad project—years in the making—embodies Giddens’s vision for the Ensemble by shedding light on those erased or overlooked in American history while showcasing Silkroad's unique ability to amplify diverse voices. The project has since evolved into cross-country tours and performances, recording releases, educational materials, and this podcast series.  After the completion of the Transcontinental Railroad, a trip from coast to coast that used to take months was shortened to just under a week, allowing for the transport of goods and ideas across the continent in ways previously inconceivable. Profit-seeking corporations and the American government financed it, but the people who actually built and were most affected by it are the focus — Indigenous and African Americans as well Irish, Chinese, Japanese, and other immigrant laborers whose contributions have been largely erased from history. Silkroad’s American Railroad seeks to paint a more accurate picture of the global diasporic origin of the American Empire. Each episode weaves music, storytelling, and historical analysis, traveling to railroad communities across the U.S. From the Chinese and Japanese laborers' crucial role in California's railroads, to the tragic tale of Black convict laborers in North Carolina, and the intersection of music and labor history in New York and Boston, the series brings to light the stories that have long been marginalized. The journey also takes us to the Standing Rock Reservation, showcasing the resilience and musical traditions of the Lakota community. Through intimate interviews with local culture bearers, historians, and Silkroad’s musicians, ""American Railroad"" paints a more accurate and inclusive picture of America's history.Join us weekly on Thursdays as we amplify the voices of those who have long been silenced, celebrate the diversity that built America, and uncover the enduring impact of these buried histories on our society today.",Silkroad,4,False,https://open.spotify.com/show/5qn1n7LvaLet6AGbWvaEc5,https://i.scdn.co/image/ab6765630000ba8a8a6bd0dbf9eb42e25a4f33ff,Music,"rgb(227, 183, 78)"
"GET REAL S4 w/ Ashley, BM, JUNNY, and PENIEL",1p42GLS0xVHfEe4ASWQKj2,"📲 Download DIVE Studios' daily wellness app (for FREE) at www.getmindset.com  GET REAL is BACK with another season! Please welcome our fantastic four hosts: ASHLEY, BM, JUNNY, and PENIEL. This show is a place for these close friends to open up about all the ups and downs of work, love, and adulthood from their perspective.  🤳 FOLLOW US ON SOCIALS 🤳 TikTok (1.6 million): www.tiktok.com/@divestudios Instagram (560k+): www.instagram.com/thedivestudios Twitter (230k+): www.twitter.com/thedivestudios Discord (45k+ members): www.discord.gg/divemindset",DIVE Studios,141,False,https://open.spotify.com/show/1p42GLS0xVHfEe4ASWQKj2,https://i.scdn.co/image/ab6765630000ba8a5550178aa6e0242ad8a77246,Music,"rgb(166, 128, 108)"
Tape Notes,5Br33snnJU90k2NcYskuM9,"Tape Notes is a podcast about the art and craft of music production. Hosted by John Kennedy, each episode reunites an artist and producer to talk about the highlights of their collaboration in the studio. Their conversations lift the lid on every stage of the creative process, from kindling the first spark of a song idea, through decisions on style and instrumentation, to finessing the final product. Full of fascinating anecdotes, the conversations also feature early demo versions and stems from the original session recordings. The result is a unique insight into the working methods of some of the most innovative and exciting talents in music.",In The Woods,160,False,https://open.spotify.com/show/5Br33snnJU90k2NcYskuM9,https://i.scdn.co/image/ab6765630000ba8ab3b3733433886b2fa38eeaf6,Music,"rgb(41, 213, 224)"
Ebro in the Morning Podcast,0dwB954oUXUr2Aje1tlRgX,"Ebro, Laura Stylez and Rosenberg share their thoughts on everything from music, relationships, politics and more Monday - Friday 5am - 10am ET.",HOT 97,100,True,https://open.spotify.com/show/0dwB954oUXUr2Aje1tlRgX,https://i.scdn.co/image/ab6765630000ba8aaccfde0991212efe66985ca3,Music,"rgb(249, 185, 35)"
NFR Podcast,6PswztvZsljtfTz3RlmsSo,Join Luca and Anthony every week as they recommend some of the best new releases and throwbacks that the music world has to offer. NFR’s exclusive audio experience offers listeners the chance to explore and discover new music.,NFR Podcast,91,True,https://open.spotify.com/show/6PswztvZsljtfTz3RlmsSo,https://i.scdn.co/image/ab6765630000ba8ac61b3604715c23bca333dff0,Music,"rgb(188, 98, 91)"
Garza Podcast,4Re2Ss3prlxFXgX0PsFzjk,"THE HEAVIEST PODCAST OF ALL TIME  Hosted by guitar player & founder of Suicide Silence, Chris Garza",Chris Garza,155,True,https://open.spotify.com/show/4Re2Ss3prlxFXgX0PsFzjk,https://i.scdn.co/image/ab6765630000ba8a9fb8f8b864565cf58c8f8704,Music,"rgb(158, 97, 217)"
THE MORNING SHIFT,1ezJJbZz2kKkoVpDwJRWj0,"Join Brook, Jordan & Matua Marc every week day from 6AM for a yarn all things culture, entertainment, sports, funny and thought provoking.If you're keen to sponsor the show or any enquiries email TMS@youknow.co.nzPowered by YOUKNOW MEDIA",YOUKNOW MEDIA,444,False,https://open.spotify.com/show/1ezJJbZz2kKkoVpDwJRWj0,https://i.scdn.co/image/ab6765630000ba8af4bb68c29f812f42939fda56,Music,"rgb(107, 147, 175)"
Hard Music ,6oW5HZRAnDldLzSHPgmSkn,music that goes hard,SansDreamYT,3,True,https://open.spotify.com/show/6oW5HZRAnDldLzSHPgmSkn,https://i.scdn.co/image/ab6765630000ba8a3e4446d080b3090550344128,Music,"rgb(255, 0, 0)"
Off the Record with DJ Akademiks,0u8NBMvWajLvc66r9NsJJs,"Off the Record with DJ Akademiks is a show about music, entertainment, and culture. After spending years reporting on the latest trends in music, Akademiks has cemented his voice in the conversation. With Off The Record, he plans to take his coverage of hip hop to the next level by bringing you the conversations you want to hear from the people you want to hear it from, first! Support this podcast: https://creators.spotify.com/pod/show/offtherecord-djakademiks/support",The Akademy,256,True,https://open.spotify.com/show/0u8NBMvWajLvc66r9NsJJs,https://i.scdn.co/image/ab6765630000ba8a82886393686b5b382d7b2505,Music,"rgb(242, 16, 13)"
2F BBMs,6nQp0redV9AFU5YtSdIekU,BBMs by 2F,2F,16,False,https://open.spotify.com/show/6nQp0redV9AFU5YtSdIekU,https://i.scdn.co/image/ab6765630000ba8a01f8d5bca44dacfe326a80f3,Music,"rgb(67, 173, 224)"
Brown Bag Mornings,0tnFAOk1lPpo3yC0lwme5J,"Letty Peniche and Rosecrans Vic come together for Brown Bag, the LA based (and biased) morning show from 2 hispanics who love to hustle, put people on game, and of course, clown. Check them out LIVE everyday on POWER 106 6A-10A, Monday thru Friday. ",Power 106,100,False,https://open.spotify.com/show/0tnFAOk1lPpo3yC0lwme5J,https://i.scdn.co/image/ab6765630000ba8aa9b23a4661316a70d9581ff9,Music,"rgb(229, 222, 148)"
No Dogs in Space,7pg4bQx8OsDIiDFZ7XtKy0,No Dogs In Space is a music history podcast featuring Marcus Parks and Carolina Hidalgo of the Last Podcast Network.  Season 1 - Punk  Season 2 - Alternative Season 3 - Experimental Rock & Pop  Subscribe to SiriusXM Podcasts+ on Apple Podcasts to listen to ad-free new episodes.,The Last Podcast Network,73,False,https://open.spotify.com/show/7pg4bQx8OsDIiDFZ7XtKy0,https://i.scdn.co/image/ab6765630000ba8aeef2f603581e80d06882969c,Music,"rgb(244, 242, 152)"
Swiftie School,2H3uYlqPHHGBS6nP661kjL,"It's another great day to be alive at the same time as Taylor Swift! Swiftie School is a weekly podcast hosted by Reagan Baylee recapping the latest easter eggs, theories and swiftivities. Submit an easter egg, theory or episode request: https://forms.monday.com/forms/5bc3aaaba66ab48125fdccab0bb1de03?r=use1Follow Reagan on Instagram: https://www.instagram.com/reagan.baylee/",Reagan Baylee,68,False,https://open.spotify.com/show/2H3uYlqPHHGBS6nP661kjL,https://i.scdn.co/image/ab6765630000ba8ab62ae3c14e6004706eb06e9d,Music,"rgb(163, 94, 119)"
Questlove Supreme,6X0ThBWpiPUplNxoaa7SMx,"Questlove Supreme is a fun, irreverent and educational weekly podcast that digs deep into the stories of musical legends and cultural icons in a way that only Questlove and Team Supreme can deliver. Led by Each episode is driven by conversation ranging from the guest’s origins (along with a few never-before-revealed secrets to their success) to their life passions and current projects. This is not your typical interview show. This is about legends and legends in the making bringing their legacy to life in their own words. Previous guests have included Usher, Michelle Obama, Chris Rock, Steve Miller, Maya Rudolph, Weird Al, Chaka Khan, Babyface and many more.",iHeartPodcasts,390,False,https://open.spotify.com/show/6X0ThBWpiPUplNxoaa7SMx,https://i.scdn.co/image/ab6765630000ba8a31cd4d434b01a14aaee96fd8,Music,"rgb(67, 195, 220)"
You'll Hear It,1XoYmezf71A4ifqAZYgndG,"A podcast about jazz - how to listen, play, practice, and enjoy. Listen for a combo of advice, insights, and occasional humor from pianists Peter Martin and Adam Maness. A podcast from Open Studio https://www.openstudiojazz.com",Peter Martin & Adam Maness,1178,False,https://open.spotify.com/show/1XoYmezf71A4ifqAZYgndG,https://i.scdn.co/image/ab6765630000ba8a16b87d8609a37d1359104f72,Music,"rgb(240, 99, 52)"
The Greatest Pop Stars of the 21st Century,2jOspBN4m5GVcjFcPM9K1y,"Billboard's staff counts down the 25 greatest pop stars since 2000, going deep on the music, careers and legacies of some of the most legendary artists of the last quarter-century.",Billboard,18,False,https://open.spotify.com/show/2jOspBN4m5GVcjFcPM9K1y,https://i.scdn.co/image/ab6765630000ba8a831e9abc78d2680845a46518,Music,"rgb(178, 13, 248)"
Kill The Posers Podcast ,76yWDoywkGT8RA6wWo4Iip,Extreme metal podcast for extreme people !! we are the killers of posers and this is KILL THE POSERS PODCAST!! keep it sick🤘,Guttedinfant And Christdenied,116,True,https://open.spotify.com/show/76yWDoywkGT8RA6wWo4Iip,https://i.scdn.co/image/ab6765630000ba8a8c96cea8328ab0d239333ebe,Music,"rgb(198, 99, 83)"
Two Friends BB Mixes,5vUPVd9kr5fijEOw9Beyk8,BBMs by 2F,Two Friends,28,False,https://open.spotify.com/show/5vUPVd9kr5fijEOw9Beyk8,https://i.scdn.co/image/ab6765630000ba8a60c6715ef626df003be58e35,Music,"rgb(67, 173, 224)"
Rap Latte,0gR224nXFZziT1hSpY6B0L,"Rap Latte, a deeper conversation about hiphop hosted by Touré and King Green. We talk about hot new albums, classic MCs, it’s a more thoughtful convo about the music we love.",Toure & King Green,11,False,https://open.spotify.com/show/0gR224nXFZziT1hSpY6B0L,https://i.scdn.co/image/ab6765630000ba8a502ed51d136e694c7e6a877c,Music,"rgb(255, 0, 0)"
The Tucker Carlson Show,5L2ON33kXa2b7laBpCAgOI,The Tucker Carlson Show is your beacon of free speech and honest reporting in a media landscape dominated by misinformation. The only solution to ending the propaganda spiral is by telling the truth. That's our job. Every day. No matter what.,Tucker Carlson Network,157,False,https://open.spotify.com/show/5L2ON33kXa2b7laBpCAgOI,https://i.scdn.co/image/ab6765630000ba8adc338dbc158629d04aca8f07,News,"rgb(246, 30, 25)"
The Megyn Kelly Show,0awxEJH88Xur0GHXuteBLw,"The Megyn Kelly Show is your home for open, honest and provocative conversations with the most interesting and important political, legal and cultural figures today. No BS. No agenda. And no fear.",SiriusXM,997,True,https://open.spotify.com/show/0awxEJH88Xur0GHXuteBLw,https://i.scdn.co/image/ab6765630000ba8a6d5f78147b6ed97bf2ba6707,News,"rgb(236, 24, 46)"
Candace,6QdzTqSvD4KoLdrOqkFkPE,This time it's just Candace. Free and unfiltered.,Candace Owens,119,False,https://open.spotify.com/show/6QdzTqSvD4KoLdrOqkFkPE,https://i.scdn.co/image/ab6765630000ba8a66fef8a30c8f989f7e5ec5c3,News,"rgb(176, 93, 107)"
Pod Save America,5JGorGvdwljJHTl6wpMXN3,"Pod Save America is a no-bullshit conversation about politics hosted by former Obama aides Jon Favreau, Jon Lovett, Dan Pfeiffer, and Tommy Vietor. It cuts through the noise to break down the week’s news and helps people figure out what matters and how they can help. They’re regularly joined by journalists, activists, politicians, entertainers, and world leaders. You can watch on YouTube or listen to new episodes every Tuesday, Wednesday and Friday.  Ad-Free Pod Save America episodes available NOW through Friends of the Pod subscription. Head to crooked.com/friends to join today!  For a transcript of an episode of Pod Save America, please email transcripts@crooked.com (edited)",Crooked Media,973,True,https://open.spotify.com/show/5JGorGvdwljJHTl6wpMXN3,https://i.scdn.co/image/ab6765630000ba8ad9a53ca745c6da3193daab6b,News,"rgb(211, 215, 136)"
The Charlie Kirk Show,0LLIIAYfTJ0axsrOcgsE0V,"Charlie is America's hardest working grassroots activist who has your inside scoop on the biggest news of the day and what's really going on behind the headlines. The founder of Turning Point USA and one of social media's most engaged personalities, Charlie is on the front lines of America’s culture war, mobilizing hundreds of thousands of students on over 3,500 college and high school campuses across the country, bringing you your daily dose of clarity in a sea of chaos all from his signature no-holds-barred, unapologetically conservative, freedom-loving point of view. You can also watch Charlie Kirk on Salem News Channel",Charlie Kirk,100,False,https://open.spotify.com/show/0LLIIAYfTJ0axsrOcgsE0V,https://i.scdn.co/image/ab6765630000ba8abea8bc78a380b037b77d8e8b,News,"rgb(80, 139, 246)"
Dan Bongino Show,4sftHO603JaFqpuQBEZReL,"He’s a former Secret Service Agent, former NYPD officer, and New York Times best-selling author. Join Dan Bongino each weekday as he tackles the hottest political issues, debunking both liberal and Republican establishment rhetoric.",Cumulus Podcast Network | Dan Bongino,2259,True,https://open.spotify.com/show/4sftHO603JaFqpuQBEZReL,https://i.scdn.co/image/ab6765630000ba8ad5166af5a659946a6e91610e,News,"rgb(208, 154, 129)"
