podcast_name,podcast_id,podcast_description,podcast_publisher,podcast_total_episodes,podcast_explicit,podcast_external_url,podcast_image_url,podcast_category,podcast_dominant_color
Modern Wisdom,0XrOqvxlqQI6bmdYHuIVnr,"Life lessons from the greatest thinkers on the planet with Chris Williamson. Including guests like David Goggins, Dr Jordan Peterson, Sam Harris, Jocko Willink, Dr Andrew Huberman, Dr Julie Smith, Steven Bartlett, Ryan Holiday, James Clear, Robert Greene, Balaji Srinivasan, Steven Pinker, Alex Hormozi, Douglas Murray, Chris Bumstead, James Smith, Dr David Sinclair, Mark Manson and more. Understanding the world is hard. This podcast will help.",Chris Williamson,870,True,https://open.spotify.com/show/0XrOqvxlqQI6bmdYHuIVnr,https://i.scdn.co/image/ab6765630000ba8afb87e8469fb87b7f25acb84a,Society & Culture,"rgb(218, 174, 150)"
Not Loveline,5JmVhyCLv8EnX4x8lXU3BB,"NOT LOVELINE is a weekly love, sex, and dating call in advice show with Tana Mongeau and Trish Paytas, two hosts who are definitely NOT experts but do have a lot of experience.",Tana Mongeau and Trish Paytas,2,True,https://open.spotify.com/show/5JmVhyCLv8EnX4x8lXU3BB,https://i.scdn.co/image/ab6765630000ba8a1d58e2827f9759262f8ac853,Society & Culture,"rgb(181, 120, 75)"
CreepCast,5Pjt7qlcii0gLqvccowYhs,"Wendigoon and MeatCanyon share the scary, occult, and...creepy stories from around the internet.",Wendigoon & MeatCanyon,32,False,https://open.spotify.com/show/5Pjt7qlcii0gLqvccowYhs,https://i.scdn.co/image/ab6765630000ba8aa982e8d35ae83a1ce61b3285,Society & Culture,"rgb(186, 239, 16)"
 What Now? with Trevor Noah,122imavATqSE7eCyXIcqZL,"Trevor currently hosts a Spotify original weekly podcast titled What Now? with Trevor Noah. In this new podcast, listeners get a chance to hear Trevor like never before. Trevor is joined each episode by celebrities, thought leaders, athletes, and friends to chat about the contemporary topics on everyone’s minds. He brings the kinds of conversations that happen behind the scenes to light - full of radical candor, authentic back-and-forths, and honest reactions, with Trevor bringing to bear his classic, effortlessly playful and equally probing style.Get in touch with us! Send your voice recordings to whatnow@dayzeroproductions.com with suggestions for topics, guests, or what you would do If You Ruled the World and we may just use it on the show!",Spotify Studios,57,False,https://open.spotify.com/show/122imavATqSE7eCyXIcqZL,https://i.scdn.co/image/ab6765630000ba8a6bbe5222eb511ffc9e5a9396,Society & Culture,"rgb(7, 249, 204)"
Stuff You Should Know,0ofXAdFIQQRsCYj9754UFx,"If you've ever wanted to know about champagne, satanism, the Stonewall Uprising, chaos theory, LSD, El Nino, true crime and Rosa Parks, then look no further. Josh and Chuck have you covered.",iHeartPodcasts,2449,False,https://open.spotify.com/show/0ofXAdFIQQRsCYj9754UFx,https://i.scdn.co/image/ab6765630000ba8a863cc2d69ef7958af5cca4b5,Society & Culture,"rgb(206, 56, 49)"
Let's Be Honest with Kristin Cavallari,6uEoGrg54MzAHY2okUPyJb,"Kristin Cavallari is back behind the microphone and more f*cking honest than ever. Let's Be Honest sets the record straight on everything from dating and relationships, nutrition and wellness, to what’s really going on behind those headlines. In her new lifestyle podcast, Cavallari dives into what connects people (and breaks them up), what makes people feel physically and spiritually healthy, and how to love yourself along the way. New episodes drop every Tuesday!",Dear Media,62,True,https://open.spotify.com/show/6uEoGrg54MzAHY2okUPyJb,https://i.scdn.co/image/ab6765630000ba8a333734b2ad72bd52dc2685e4,Society & Culture,"rgb(174, 131, 110)"
The Why Files: Operation Podcast,2hm3NRGFO5rRVDEhA0stZI,"The Why Files covers mysteries, myths and legends. We tell stories and seek the truth in a fun and lighthearted way. Our content is heavily researched; we don't release an episode unless we're sure we can bring something new to a topic.",The Why Files: Operation Podcast,192,False,https://open.spotify.com/show/2hm3NRGFO5rRVDEhA0stZI,https://i.scdn.co/image/ab6765630000ba8ad30854016cebc87834f0ec69,Society & Culture,"rgb(249, 33, 59)"
This American Life,41zWZdWCpVQrKj7ykQnXRc,"Each week we choose a theme. Then anything can happen. This American Life is true stories that unfold like little movies for radio. Personal stories with funny moments, big feelings, and surprising plot twists. Newsy stories that try to capture what it’s like to be alive right now. It’s the most popular weekly podcast in the world, and winner of the first ever Pulitzer Prize for a radio show or podcast. Hosted by Ira Glass and produced in collaboration with WBEZ Chicago.",This American Life,13,False,https://open.spotify.com/show/41zWZdWCpVQrKj7ykQnXRc,https://i.scdn.co/image/ab6765630000ba8a91abbd997cff7b9b4497c930,Society & Culture,"rgb(250, 12, 12)"
The Way I Heard It with Mike Rowe,5cqHs2kCabyijuKOSN2QUS,"What started as a series of short mysteries for the curious mind with a short attention span has evolved into enlightening conversations for the not-so-short attention span. Whether it’s a short mystery, a long conversation, or an audio book, The Way I Heard It is a veritable box of chocolates for the ears, because you never know what you’re going to get.",The Way I Heard It with Mike Rowe,417,False,https://open.spotify.com/show/5cqHs2kCabyijuKOSN2QUS,https://i.scdn.co/image/ab6765630000ba8a7d7bbe4cfb9c6b1cb1fbe38d,Society & Culture,"rgb(83, 186, 192)"
The Telepathy Tapes,1zigaPaUWO4G9SiFV0Kf1c,"In a world that often dismisses the extraordinary as mere fantasy, The Telepathy Tapes dares to explore the profound abilities of non-speakers with autism—individuals who have long been misunderstood and underestimated. These silent communicators possess gifts that defy conventional understanding, from telepathy to otherworldly perceptions, challenging the limits of what we believe to be real.  For years, their parents and teachers have quietly witnessed these remarkable abilities, knowing that the time to share their truth would eventually come. But now, as the evidence mounts, the time has come to reveal what has been hidden in plain sight. This groundbreaking series challenges everything we think we know about communication and the human mind, inviting viewers to step into a reality where the impossible is not only possible but happening every day. Through emotional stories and undeniable evidence, The Telepathy Tapes offers a fresh perspective on the profound connections that exist beyond words. Traveling with Neuroscientist Dr. Diane Hennacy Powell, witnessing mind-boggling telepathy tests and forging deeply intimate relationships with families around the globe - Host Ky Dickens invites you to contemplate the world through the eyes of those who speak without words. Prepare to be captivated, challenged, and ultimately transformed as the series shines a light on the untold capabilities of those who have been underestimated for far too long.  Hosted on Acast. See acast.com/privacy for more information.",Ky Dickens,12,False,https://open.spotify.com/show/1zigaPaUWO4G9SiFV0Kf1c,https://i.scdn.co/image/ab6765630000ba8a8886cd685dd33000cece05bb,Society & Culture,"rgb(242, 166, 179)"
Honestly with Bari Weiss,0GRPAKeSMASfbQ7VgNwYCR,"The most interesting conversations in American life happen in private. This show brings them out of the closet. Stories no one else is telling and conversations with the most fascinating people in the country, every week from The Free Press, hosted by former New York Times and Wall Street Journal journalist Bari Weiss.",The Free Press,261,False,https://open.spotify.com/show/0GRPAKeSMASfbQ7VgNwYCR,https://i.scdn.co/image/ab6765630000ba8a7f38b5c9d725357944703727,Society & Culture,"rgb(248, 51, 11)"
Where Everybody Knows Your Name with Ted Danson and Woody Harrelson (sometimes),6IFupHjWX5j7mPxzETjnYT,"Ted Danson and Woody Harrelson are total opposites with an unbreakable bond since meeting on the hit sitcom “Cheers.” But after that show wrapped, life took them in different directions. This podcast is a chance to reconnect, both with each other and the amazing friends they’ve each met over the decades—that is, when Ted can get a hold of Woody! Join them as they dig beyond the career highlights and into the stuff of life that makes us who we are. Like the title says, this is a place to be known.","Team Coco & Ted Danson, Woody Harrelson",30,True,https://open.spotify.com/show/6IFupHjWX5j7mPxzETjnYT,https://i.scdn.co/image/ab6765630000ba8a3d92a33b20e7388d92d00a97,Society & Culture,"rgb(64, 247, 163)"
Against the Rules with Michael Lewis,5vaBQ06qUNNU5w90KMnqw8,"Journalist and bestselling author Michael Lewis explores the figures in American life who rely on the public's trust, whether in sports, in business, in the courtroom, or on TV. What happens when that trust erodes and we can no longer agree on what's fair and what's not? In the latest season of his podcast, Michael takes on America’s newest form of legalized gambling, sports betting, and how it’s changing what it means to be a player…a teenager…and most of all, a fan. iHeartMedia is the exclusive podcast partner of Pushkin Industries.",Pushkin Industries,87,True,https://open.spotify.com/show/5vaBQ06qUNNU5w90KMnqw8,https://i.scdn.co/image/ab6765630000ba8a239bba460d6e163971d67a0c,Society & Culture,"rgb(180, 107, 251)"
Danny Jones Podcast,4VTLG0HiIZaCjH9gE6NFPq,Danny’s quest to get smarter.,Danny Jones,272,False,https://open.spotify.com/show/4VTLG0HiIZaCjH9gE6NFPq,https://i.scdn.co/image/ab6765630000ba8aa4811d1d8c6e2e503a0d385c,Society & Culture,"rgb(232, 112, 31)"
Where Should We Begin? with Esther Perel,3fKOTwtnX5oZLaiNntKWAV,"Every Monday morning step into the office of iconic psychotherapist Esther Perel and listen in as real people in search of insight bare the raw, intimate, and profound details of their stories. From breakups and open relationships to workplace conflicts and fractures in the family, it’s a place to hear our own stories reflected in the lives of others. So…where should we begin? Part of the Vox Media Podcast Network.",Esther Perel Global Media,112,True,https://open.spotify.com/show/3fKOTwtnX5oZLaiNntKWAV,https://i.scdn.co/image/ab6765630000ba8a2ea30b2ae35a7cb298f34f3c,Society & Culture,"rgb(246, 188, 87)"
Freakonomics Radio,6z4NLXyHPga1UmSJsPK7G1,"Freakonomics co-author Stephen J. Dubner uncovers the hidden side of everything. Why is it safer to fly in an airplane than drive a car? How do we decide whom to marry? Why is the media so full of bad news? Also: things you never knew you wanted to know about wolves, bananas, pollution, search engines, and the quirks of human behavior.   To get every show in our network without ads and a monthly bonus episode of Freakonomics Radio, sign up for SiriusXM Podcasts+ on Apple Podcasts at http://apple.co/SiriusXM.",Freakonomics Radio + Stitcher,799,False,https://open.spotify.com/show/6z4NLXyHPga1UmSJsPK7G1,https://i.scdn.co/image/ab6765630000ba8ad8cbc1b0e35fb151ae472695,Society & Culture,"rgb(229, 127, 37)"
De Saída - A Vida Fora da Internet,5O54TkP9Kel4Pr8zN4o5RY,"Uma das maiores YouTubers do Brasil não tem nome numa cidade de mil habitantes. As pessoas a conhecem de vista e de risadas soltas. É essa a única pista que Chico Felitti e Beatriz Trevisan seguem para tentar encontrar Julia Tolezano da Veiga Faria, a Jout Jout. A resposta só vem seis meses depois do início dessa busca. Depois de quatro anos de silêncio, Julia convida Beatriz para entrar na sua casa e falar sobre sua vida sem qualquer hesitação. De Saída: A Vida Fora da Internet é um podcast que procura uma das youtubers mais famosas do Brasil, anos depois de ela sumir. É também uma série que discute o que nós fazemos com as redes sociais, e o que as redes sociais fazem com a gente.De Saída - A Vida Fora da Internet é um podcast da Pachorra Felitti Áudios, Livros e Filmes.Chico Felitti é criador e roteirista. Beatriz Trevisan fez a reportagem e também assina o roteiro.A produção é de Otávio Bonfá e Allan Batista. Luan Alencar faz a edição de som.Arte de capa de Catarina Pignato.A gerência do canal é de Domenica Mendes.",Chico Felitti & Beatriz Trevisan,2,False,https://open.spotify.com/show/5O54TkP9Kel4Pr8zN4o5RY,https://i.scdn.co/image/ab6765630000ba8a3a4cca97a6c0844e102f1846,Society & Culture,"rgb(221, 156, 147)"
Cancelled with Tana Mongeau & Brooke Schofield,3HaUSQyHM1LNcOZEsG4Be6,"EXTRA! EXTRA! CANCELLED is coming back better than ever with your favorite co-host besties Tana Mongeau and Brooke Schofield. After years of growing up under the constant scrutiny of public opinion, social media juggernaut, Tana Mongeau, is officially taking back the mic (again!). Acting as a natural evolution of her acclaimed “storytime” videos, this show offers an intimate look at Mongeau, her meteoric rise to superstardom, and the unavoidable moments of vulnerability that make this cyber-personality all the more human. CANCELLED will continue to seek to shed a new light, not only on its hosts, but on the enigmatic world of “the influencer,” featuring lively celeb tell-alls, current event commentary, and Tana and Brooke’s unfiltered take on the drama that relentlessly follows them both.",Cancelled & Audioboom Studios,106,True,https://open.spotify.com/show/3HaUSQyHM1LNcOZEsG4Be6,https://i.scdn.co/image/ab6765630000ba8ac1cdb949a89e681a3f2965a7,Society & Culture,"rgb(236, 53, 41)"
Hot Mess with Alix Earle,6cRP8gclqWDfA9pkKsqDPv,"Hot Mess with Alix Earle is the ultimate girls' group chat brought to life. Join Alix as she takes you behind the scenes into wild nights out, chaotic morning recaps, and all the messy moments in between. With her sister Ashtin by her side, the Earle Girls dive deep into candid conversations about family, friendships, mental health, and more. Navigating your 20s can be a whirlwind, but if you’re going to be a mess, why not make it a hot one? Tune in every Thursday for episodes packed with raw honesty, insightful advice, and hilarious sister banter.",Unwell,62,True,https://open.spotify.com/show/6cRP8gclqWDfA9pkKsqDPv,https://i.scdn.co/image/ab6765630000ba8a44050ea4239b65eb487433af,Society & Culture,"rgb(192, 96, 110)"
Wartime Stories,23Xmy3AvSXKIiHDnaysyN8,"Every soldier has a story. Some, they try to forget. Others, they can’t stop thinking about – stories that no one else would believe happened. Something that terrified them. Something they cannot explain.From Ballen Studios, and hosted by Marine Corp Reconnaissance veteran, Luke Lamana, this is Wartime Stories. A weekly podcast that is a mix of horror, mystery, and awe inspiring tales. Where the strange, dark & mysterious meets the battlefield and beyond. New episodes every Monday.Share your stories: info@wartimestories.com",Ballen Studios,26,True,https://open.spotify.com/show/23Xmy3AvSXKIiHDnaysyN8,https://i.scdn.co/image/ab6765630000ba8a25171fb90447a86e85679097,Society & Culture,"rgb(104, 189, 198)"
First Date Follow Up - The Jubal Show,2GGgS0ZbK0QuIr6zqgxqoL,"What happens when you get ghosted after a first date? You call The Jubal Show and have them find out why! It's like putting yourself in a situation to get roasted, when you really just want a second date.",The Jubal Show,770,False,https://open.spotify.com/show/2GGgS0ZbK0QuIr6zqgxqoL,https://i.scdn.co/image/ab6765630000ba8a60a3b32f52cd4321aa2d2c59,Society & Culture,"rgb(152, 144, 249)"
Behind the Bastards,0rOatMqaG3wB5BF4AdsrSX,"There’s a reason the History Channel has produced hundreds of documentaries about Hitler but only a few about Dwight D. Eisenhower. Bad guys (and gals) are eternally fascinating. Behind the Bastards dives in past the Cliffs Notes of the worst humans in history and exposes the bizarre realities of their lives. Listeners will learn about the young adult novels that helped Hitler form his monstrous ideology, the founder of Blackwater’s insane quest to build his own Air Force, the bizarre lives of the sons and daughters of dictators and Saddam Hussein’s side career as a trashy romance novelist.",Cool Zone Media and iHeartPodcasts,890,True,https://open.spotify.com/show/0rOatMqaG3wB5BF4AdsrSX,https://i.scdn.co/image/ab6765630000ba8a924810d8d6c548c913b44551,Society & Culture,"rgb(218, 94, 94)"
Radio Rental,18WzIf6SqovUQHHTeZaucQ,"Discover real-life horror stories, from bizarre crimes to paranormal activity. These true stories are set inside the fictional world of Radio Rental, an 80’s video rental store run by an eccentric shopkeeper, Terry Carnation (Rainn Wilson). This imaginative, cult classic-inspired horror brand blurs the lines of reality, with cutting-edge documentary storytelling and a splash of comedy. From the mind of Payne Lindsey, this is Radio Rental.",Tenderfoot TV & Audacy,84,True,https://open.spotify.com/show/18WzIf6SqovUQHHTeZaucQ,https://i.scdn.co/image/ab6765630000ba8a90121bbfe4d0de37e2c01347,Society & Culture,"rgb(69, 99, 188)"
Date Yourself Instead,6ie2ywivlNvFCO8LLJYgo7,"You’ve made it to Date Yourself Instead, a podcast intended to inspire you to become the best version of yourself. In 2021, social media personality Lyss started a self-love series on TikTok which amassed over 100+ million views on her videos and counting. In this podcast, she gets candid about her relationship experiences, and touches on other topics including business, beauty, wellness, and so much more. Welcome to the #dateyourselfinstead movement. Episodes every Monday.",Lyss Boss,124,True,https://open.spotify.com/show/6ie2ywivlNvFCO8LLJYgo7,https://i.scdn.co/image/ab6765630000ba8a18011ea4bb43bdeb8e60504a,Society & Culture,"rgb(106, 141, 169)"
The Comments Section with Brett Cooper,1ZPQSEIADOCw4xpI5zn6Mx,"Welcome to The Comments Section with Brett Cooper – an irreverent viral content and news review show offering an against-the-grain, laid-back perspective on today’s culture.",The Daily Wire,253,False,https://open.spotify.com/show/1ZPQSEIADOCw4xpI5zn6Mx,https://i.scdn.co/image/ab6765630000ba8a51856bd87340cc44bca37ecf,Society & Culture,"rgb(119, 165, 185)"
We Can Do Hard Things,0eFL5HJejQHZrdgAFdPnOm,"Life is freaking hard. We are all doing hard things every single day – things like loving and losing; caring for children and parents; forging and ending friendships; battling addiction, illness, and loneliness; struggling in our jobs, our marriages, and our divorces; setting boundaries; and fighting for equality, purpose, freedom, joy, and peace. On We Can Do Hard Things, Glennon Doyle, author of UNTAMED; her wife Abby Wambach; and her sister Amanda Doyle do the only thing they’ve found that has ever made life easier: Drop the fake and talk honestly about the hard things including sex, gender, parenting, blended families, bodies, anxiety, addiction, justice, boundaries, fun, quitting, overwhelm . . . all of it. We laugh and cry and help each other carry the hard so we can all live a little bit lighter and braver, free-er, less alone.",Glennon Doyle and Audacy,407,False,https://open.spotify.com/show/0eFL5HJejQHZrdgAFdPnOm,https://i.scdn.co/image/ab6765630000ba8a31936fcc7887c8a10ba9af9d,Society & Culture,"rgb(221, 191, 102)"
The Wirecutter Show,2OanhZTRMZhn004ln8ikyj,"The Wirecutter Show is a podcast offering expert advice on everyday products that will make your life better. Each week, co-hosts Christine Cyr Clisset and Caira Blackwell, alongside producer Rosie Guerin, speak with Wirecutter’s best-in-class journalists and other expert guests for actionable advice, surprising life hacks, and delightful product discoveries. From which stand-mixer will last you a lifetime, to the best way to travel with pets, to figuring out if your smart lock is spying on you, The Wirecutter Show gives you straightforward solutions based on years of rigorous and independent product testing by more than 140 Wirecutter journalists.",The New York Times,19,False,https://open.spotify.com/show/2OanhZTRMZhn004ln8ikyj,https://i.scdn.co/image/ab6765630000ba8a856b6425b3b4591f994dd626,Society & Culture,"rgb(152, 201, 238)"
Philosophize This!,2Shpxw7dPoxRJCdfFXTWLE,"Beginner friendly if listened to in order! For anyone interested in an educational podcast about philosophy where you don't need to be a graduate-level philosopher to understand it. In chronological order, the thinkers and ideas that forged the world we live in are broken down and explained.",Stephen West,216,False,https://open.spotify.com/show/2Shpxw7dPoxRJCdfFXTWLE,https://i.scdn.co/image/ab6765630000ba8a16116dc84b5da8d9905a35ec,Society & Culture,"rgb(255, 0, 0)"
If Books Could Kill,2khJBoF73ujIATWUFtSxLD,The airport bestsellers that captured our hearts and ruined our minds,Michael Hobbes & Peter Shamshiri,53,True,https://open.spotify.com/show/2khJBoF73ujIATWUFtSxLD,https://i.scdn.co/image/ab6765630000ba8a10cd4bdfe0e165d9aa3e1349,Society & Culture,"rgb(21, 181, 249)"
All There Is with Anderson Cooper,4fm93OGs4upQbKv8hngvmH,"Grief can feel so lonely but talking about it, and listening to others share their grief experiences helps. In Season 3 of All There Is, Anderson Cooper continues his deeply personal exploration of grief in all its complexities. In moving and honest discussions, he learns from others who’ve experienced life-altering losses. All There Is with Anderson Cooper is about the people we lose, the people left behind, and how we can live on – with loss and with love. | Visit the All There Is online grief community at cnn.com/allthereisonline",CNN,29,False,https://open.spotify.com/show/4fm93OGs4upQbKv8hngvmH,https://i.scdn.co/image/ab6765630000ba8a4240e0fb4e544db2c6247e45,Society & Culture,"rgb(158, 123, 105)"
A Bit Fruity with Matt Bernstein,6eHVj5xWPLDQljOg9mJkWO,"For years, Matt’s been unpacking the events, people, and culture wars shaping the world around us. On A Bit Fruity, we take deeper dives into those issues — joined by celebrities, experts, and journalists who help us laugh and learn along the way.  Follow Matt: https://www.instagram.com/mattxiv Subscribe on YouTube: https://www.youtube.com/@MattBernstein1",Matt Bernstein,34,True,https://open.spotify.com/show/6eHVj5xWPLDQljOg9mJkWO,https://i.scdn.co/image/ab6765630000ba8a3d9a0c76fd0a4afbd5eedbdb,Society & Culture,"rgb(228, 229, 85)"
Sold a Story,0tcUMXBFMGMe8w79MM5QCI,"Millions of kids can't read well. Scientists have known for decades how children learn to read, but many schools don’t know about the research. They buy teacher training and books that are rooted in a disproven idea. In Sold a Story, Emily Hanford investigates four authors and a publishing company that have made millions selling this idea. The podcast has won some of the biggest awards in journalism. Twenty-five states (and counting) have changed their reading laws because of it.",APM Reports,17,True,https://open.spotify.com/show/0tcUMXBFMGMe8w79MM5QCI,https://i.scdn.co/image/ab6765630000ba8a5ef9ec96e25bddbed693377d,Society & Culture,"rgb(190, 115, 118)"
Locked In with Ian Bick,2UjiFLVz77x1TQ2V7bsrJv,"Listen to riveting life stories shared by a diverse array of individuals, guided by Ian Bick whose own stint in federal prison offers a unique viewpoint as host. In his captivating show, Ian connects with people from all walks of life, spanning former inmates, recovering addicts, law enforcement officers, legal experts, mental health specialists and those who've weathered traumatic experiences and failure. Through heartfelt dialogues, these resilient souls unveil their journeys, revealing the unyielding human spirit amid adversity. From confronting darkness to surmounting setbacks, their stories kindle hope, strength, and profound transformation, underscoring the limitless potential within each of us to overcome life's trials.",Ian Bick,264,True,https://open.spotify.com/show/2UjiFLVz77x1TQ2V7bsrJv,https://i.scdn.co/image/ab6765630000ba8a02941560166fb8992eaf1b78,Society & Culture,"rgb(202, 161, 135)"
I've Had It,5HYmraLuzUrzy7yX5mzMLB,"Join Jennifer Welch and Angie “Pumps” Sullivan and their special guests on “I’ve Had It” and let this comedic, feel-good podcast expose you to all the things you didn’t know you’ve HAD IT with!",Jennifer Welch and Angie Sullivan ,210,True,https://open.spotify.com/show/5HYmraLuzUrzy7yX5mzMLB,https://i.scdn.co/image/ab6765630000ba8a47a8400b8cf209362ca224df,Society & Culture,"rgb(195, 134, 87)"
Lights Out Library: Sleep Documentaries,2KZFL3Lzi64OC0SjZeNoyo,"Lights Out Library helps you fall asleep with soothing stories across a diverse range of topics: science, history, mythology, astronomy, mystery, art and so much more. We make it possible to both calm and enrich your mind while you drift into dreamland. Please follow to support our work.  Listen ad free and get access to bonus content on our Patreon: ⁠⁠⁠https://www.patreon.com/LightsOutLibrary621⁠⁠⁠",Olimpia,56,False,https://open.spotify.com/show/2KZFL3Lzi64OC0SjZeNoyo,https://i.scdn.co/image/ab6765630000ba8ace44bf889cecf0f3a89f4aba,Society & Culture,"rgb(193, 135, 70)"
Karma & Chaos with Kail Lowry & Becky Hayter,5mlj3yYBoJxgYzZyUN1sm2,"Join Kail Lowry and Becky Hayter as these two rekindle their friendship and navigate the highs, lows, and hilarious in-betweens of life in their 30s. They’ll dive into the joys and challenges of raising families, staying true to friendships, and keeping up with pop culture - all while embracing the unpredictable mix of karma and chaos that life throws at them. With Kail’s unfiltered outlook and Becky’s infectious humor, Karma & Chaos is a refreshing, real, and relatable take on modern adulthood.  New episodes every Tuesday!",PodcastOne,10,True,https://open.spotify.com/show/5mlj3yYBoJxgYzZyUN1sm2,https://i.scdn.co/image/ab6765630000ba8ac64e2583ad249be4fa7cd4f8,Society & Culture,"rgb(213, 117, 72)"
