podcast_name,podcast_id,podcast_description,podcast_publisher,podcast_total_episodes,podcast_explicit,podcast_external_url,podcast_image_url,podcast_category,podcast_dominant_color
The NoSleep Podcast,5XhS5WBxLYgN3S9KhEyrrF,"The NoSleep Podcast is a multi-award winning anthology series of original horror stories, with rich atmospheric music to enhance the frightening tales.",Creative Reason Media Inc.,635,True,https://open.spotify.com/show/5XhS5WBxLYgN3S9KhEyrrF,https://i.scdn.co/image/ab6765630000ba8acecf3b53134ffccb27eb9b63,Fiction,"rgb(51, 215, 215)"
Historias Embrujadas Podcast,3CIHueqTYeMg2IlVMPXG2V,"Bienvenidos a Historias Embrujadas, el podcast donde la maldad se convierte en protagonista. Aquí, cada episodio es un viaje a los rincones más crudos y siniestros de la brujería, donde los rituales prohibidos, las maldiciones ancestrales y los pactos demoniacos toman vida a través de relatos siniestros.",Historias Embrujadas,8,True,https://open.spotify.com/show/3CIHueqTYeMg2IlVMPXG2V,https://i.scdn.co/image/ab6765630000ba8ab4c13c432dfb58fe12158c14,Fiction,"rgb(118, 153, 189)"
We're Alive,72cVljR6gfw5yiVUDMo6g3,"Listen to the entire epic series, which follows Survivors in Los Angeles after the world has been turned upside down. It begins with “A Story of Survival” which spans from Chapters 1-48. Our survivors band together, fortify a safe haven known as the Tower, and discover that the Infected are far from the biggest threat they will have to face.The adventure continues with two mini-series:“Lockdown” - A small group of inmates and prison guards are trapped in the T-block at Twin Towers Jail. They are forced to work together and find a way to escape while the rest of the world ends around them.“Goldrush” - Set 17 years after the main events of “A Story of Survival”, this is a recollection story that describes the efforts of the four Soldiers as they attempt a side mission to retrieve a suspected stash of gold bullion.Our newest season is “We’re Alive: Descendants”:The story of survival continues; the fight is not over.18 years after the Outbreak, the world is starting to re-organize and rebuild, but many different forms of humanity are still struggling to survive in the aftermath. Nicholas Tink grew up in the shadow of his father- the late, great, Saul Tink. Little does he know that deep in the places where infected dwell, another descendant lies waiting. Content Warning: This podcast contains descriptions of graphic violence, sexual references, and strong language. Listener discretion is advised. Hosted on Acast. See acast.com/privacy for more information.",Wayland Productions Inc,200,True,https://open.spotify.com/show/72cVljR6gfw5yiVUDMo6g3,https://i.scdn.co/image/ab6765630000ba8aa7de534fd97f0bf3225ed0c2,Fiction,"rgb(246, 26, 27)"
After Dark,3gZikZZldwY6J7vFCLV7ox,"Welcome to After Dark, a horror podcast telling the most terrifying stories... after dark. Each episode is filled with tales of terror, mystery, and the supernatural, designed to keep you on edge long after sunset. So turn off the lights, settle in, and prepare for a scary story after dark.      * * *  DISCLAIMER: This podcast contains explicit content. Parental guidance is strongly advised for children under the age of 18. Listen at your own discretion.     Copyright © 2024 After Dark      #horrorstories #scarystories #afterdark #horror #horrorpodcast",After Dark Studios,5,True,https://open.spotify.com/show/3gZikZZldwY6J7vFCLV7ox,https://i.scdn.co/image/ab6765630000ba8a43f3897aae54e6cf84d03f1f,Fiction,"rgb(255, 0, 0)"
My Diary Animated,3FpOxHqpQSQRhDLoQb2LL4,"Hello! Welcome To My Diary Animated 😍 My Diary Animated is a YouTube channel that turns real teenagers’ stories into animations. Our team aims to create a strong and safe community for teens where they can share their emotional, awkward, heartbreaking, most importantly, REAL STORIES with the world.  All content in this channel is owned by SCONNECT #WOAStory #StoryTime #animatedstories  -------------------------------------- About us ► Website: https://woanetwork.com ► General inquiry: info@woanetwork.com ► Business partnership: business@woanetwork.com ► SCONNECT website: https://s-connect.net",My Diary Animated,42,False,https://open.spotify.com/show/3FpOxHqpQSQRhDLoQb2LL4,https://i.scdn.co/image/ab6765630000ba8ac50ed3678c6a9ce502436973,Fiction,"rgb(249, 58, 135)"
Connor Pugs ,22BnYI5VssrkSKbEqV7X1j,"Here are all the storytime videos from Connor Pugs. Connor Pugs makes stories on a variety of topics, and his main inspirations for storytime videos are scrubby aka scrubs and Luna.  Support this podcast: https://creators.spotify.com/pod/show/connor-pugs/support",Connor Pugs,922,False,https://open.spotify.com/show/22BnYI5VssrkSKbEqV7X1j,https://i.scdn.co/image/ab6765630000ba8a1753fa10d011d82558809cd0,Fiction,"rgb(214, 179, 134)"
Station 151,6ivVLrV6gUo1Xbi0BhMHnc,"Station 151 is Antarctica’s first and only astronomical radio observatory. Built by the Telders Corporation at an estimated cost of $200M USD, the station promises to reveal the darkest secrets of the universe. Join Astrophysicist Wayne Robertson at the bottom of the world as he sets off on the adventure of a lifetime (and possibly his last). Station 151 is a science-fiction podcast written by Andy Scearce and Steven James Scearce. It is produced by Bear Weiter and Pale Matter.",Pale Matter | Realm,31,True,https://open.spotify.com/show/6ivVLrV6gUo1Xbi0BhMHnc,https://i.scdn.co/image/ab6765630000ba8ad842736260ecdb0120f76aa3,Fiction,"rgb(98, 173, 246)"
CreepsMcPasta Creepypasta Radio,7l0iRPdyi5UcHtDVWStxl4,'Creepypastas' are the urban legends of the internet. A new age of horror told through digital word of mouth.,Creeps McPasta,1000,False,https://open.spotify.com/show/7l0iRPdyi5UcHtDVWStxl4,https://i.scdn.co/image/ab6765630000ba8a25278fe25295ac956e9944f8,Fiction,"rgb(231, 190, 56)"
As The Raven Dreams Podcast,1EFYMKPBTTkmKyDla2JE1Q,"The As The Raven Dreams podcast is a show where we explore the darker parts of human existence through true and harrowing stories. From sinister encounters with strangers, paranormal encounters that defy explanation, unsettling mysteries that linger in the shadows- and the always bizarre glitch in the matrix stories. So I implore you turn down the lights, tune in, and let the haunting tales of everyday people take you down that dark and creepy road. Remember, these aren't just stories... these are true experiences that remind us that our world can truly be terrifying. Sleep Well.   Note: None of the audio on this podcast is created through AI, it is 100% my voice. I am a team of 1 person, so mistakes do happen sometimes. Also, these stories are from everyday people (listeners, reddit and Forums), as such, they may sound like they are written by everyday people and not paid authors- because they are.",As The Raven Dreams,525,False,https://open.spotify.com/show/1EFYMKPBTTkmKyDla2JE1Q,https://i.scdn.co/image/ab6765630000ba8a81dc5bb58f9965deec77596d,Fiction,"rgb(195, 205, 81)"
Strawbry's Cds,6n2QaS3iUseXLep3GOpTxa,"Hi! Im Strawbry and I'll be uploading audios here! Like F4F , M4F, M4M and more. My suggestion box is open!",strawbry,19,True,https://open.spotify.com/show/6n2QaS3iUseXLep3GOpTxa,https://i.scdn.co/image/ab6765630000ba8a32e83542baf0ec6bc81f327b,Fiction,"rgb(255, 0, 0)"
How i Died,03M0PmhWFgAxgUKUKXvy9b,"Bodies are piling up in the strange town of Springfield, and forensic pathologist Jonathan Spacer intends to find out why. But, Jon isn’t without his own secrets… He can talk to the dead, for starters. A full-cast serial fiction podcast for mature audiences. Available now on all podcast apps. Find us on Patreon for premium content, including bonus episodes and early access: https://www.patreon.com/HowIDied",Audiohm Media,70,True,https://open.spotify.com/show/03M0PmhWFgAxgUKUKXvy9b,https://i.scdn.co/image/ab6765630000ba8a26da8e8e1751a9532ea72c58,Fiction,"rgb(83, 175, 88)"
The White Vault,2zaOPON66InniTdoEoPai5,Explore the far reaches of the world’s horrors in the audio drama podcast The White Vault. Follow the collected records of a repair team sent to Outpost Fristed in the vast white wastes of Svalbard and unravel what lies waiting in the ice below. This Fool and Scholar production is intended for mature audiences.,Fool and Scholar Productions,103,True,https://open.spotify.com/show/2zaOPON66InniTdoEoPai5,https://i.scdn.co/image/ab6765630000ba8a4f53bfad83cb7bc95842b1af,Fiction,"rgb(105, 145, 163)"
SCP Archives,72aUDFGFu1acKQ6noDj7Fm,"Secure. Contain. Protect. There are things that go bump in the night. Fantastic things. Horrible things. Redacted things. The SCP Foundation was built to keep humanity safe from a world of beings it doesn’t want to know exists. Things of wonder. Things of destruction. And these things have files. A LOT of files. New episodes weekly. * * * Content related to the SCP Foundation, including these podcasts, are licensed under Creative Commons Sharealike 3.0. Concepts originate from works on the SCP Foundation Wiki",Bloody FM,221,True,https://open.spotify.com/show/72aUDFGFu1acKQ6noDj7Fm,https://i.scdn.co/image/ab6765630000ba8a4c59c71dd4e398e87c15417b,Fiction,"rgb(125, 176, 205)"
Scare You To Sleep,2sNFsS8B0qvIg1jK0Vo7Ns,"Curl up and relax as I read you a spooky bed time story! Join me in enjoying the soothing, although somewhat unnerving, sounds of all that goes bump in the night.From ghosts in the bayou to serial killers in the 90s, we've got everything you need to be scared to sleep! Get bonus content on Patreon",Bloody FM,364,True,https://open.spotify.com/show/2sNFsS8B0qvIg1jK0Vo7Ns,https://i.scdn.co/image/ab6765630000ba8af760c536c01d8d9e006da382,Fiction,"rgb(250, 6, 6)"
End of All Hope,63EG22GCxZm6YVWlyVyG5K,A fictional podcast following three survivors as they trek across the country trying to survive an alien invasion.,Bloody FM,92,False,https://open.spotify.com/show/63EG22GCxZm6YVWlyVyG5K,https://i.scdn.co/image/ab6765630000ba8a8e53fec68a24814f23f55a60,Fiction,"rgb(215, 82, 56)"
Huberman Lab,79CkJF3UJTHFV8Dse3Oy0P,"The Huberman Lab podcast is hosted by Andrew Huberman, Ph.D., a neuroscientist and tenured professor in the department of neurobiology, and by courtesy, psychiatry and behavioral sciences at Stanford School of Medicine. The podcast discusses neuroscience and science-based tools, including how our brain and its connections with the organs of our body control our perceptions, our behaviors, and our health, as well as existing and emerging tools for measuring and changing how our nervous system works. Huberman has made numerous significant contributions to the fields of brain development, brain function, and neural plasticity, which is the ability of our nervous system to rewire and learn new behaviors, skills, and cognitive functioning. He is a McKnight Foundation and Pew Foundation Fellow and was awarded the Cogan Award, given to the scientist making the most significant discoveries in the study of vision, in 2017.  Work from the Huberman Laboratory at Stanford School of Medicine has been published in top journals, including Nature, Science, and Cell, and has been featured in TIME, BBC, Scientific American, Discover, and other top media outlets. In 2021, Dr. Huberman launched the Huberman Lab podcast. The podcast is frequently ranked in the top 10 of all podcasts globally and is often ranked #1 in the categories of Science, Education, and Health & Fitness.",Scicomm Media,253,True,https://open.spotify.com/show/79CkJF3UJTHFV8Dse3Oy0P,https://i.scdn.co/image/ab6765630000ba8aaa4830256e4b613f07287208,Health & Fitness,"rgb(22, 172, 237)"
The Mindset Mentor,706hylM6zaDW8LrrYxcggQ,"The Mindset Mentor™ podcast is designed for anyone desiring motivation, direction, and focus in life. Host Rob Dial has amassed a passionate following of over 3 million social media followers, including business professionals, entrepreneurs, and small business owners with his expertise and passion for helping motivate people to become the best version of themselves. In this podcast, Rob blends neurology, neurobiology, psychology, early childhood development, cognitive behavioral therapy so that you can understand the way your brain and body work together, because when you understand yourself, it makes it much easier to make a plan to change and succeed. When you master your mindset, you master your life. Over the past 15 years, he has studied with some of the greatest thought leaders of our time like Tony Robbins, Ram Dass, Dr. Joe Dispenza, Jay Shetty, Andrew Huberman and many more. If you're ready to take your life to the next level, are searching for more purpose or you just need extra inspiration or motivation, tune in to The Mindset Mentor Podcast. Follow Rob on Instagram @RobDialJr https://www.instagram.com/robdialjr/  Past guests include Tony Robbins, Matthew McConaughey, Jay Shetty, Andrew Huberman, Lewis Howes, Gregg Braden, and Dr Steven Gundry.",Rob Dial,1568,True,https://open.spotify.com/show/706hylM6zaDW8LrrYxcggQ,https://i.scdn.co/image/ab6765630000ba8aec6a752096d016b435156145,Health & Fitness,"rgb(212, 165, 127)"
Sober Strength,39yzBHkDaygtYFZtQC2tJU,"Sober Strength is a show about seeking moderation in a world of unrelenting excess. Through powerful stories, expert insights, and ancient wisdom, you’ll learn how to conquer habits, resist excess, and build lasting strength—inside and out.  Hosted by USMC veteran, fitness expert, and mental health advocate Jesse Carrajat, we're redefining ""sober"" to mean balance in ALL areas of life—not just alcohol. Join us every Wednesday for full episodes and Fridays for bonus content. Discover your Sober Strength. #LiveDeep",Altum Fitness,56,True,https://open.spotify.com/show/39yzBHkDaygtYFZtQC2tJU,https://i.scdn.co/image/ab6765630000ba8a57472ca86f166e461a4fb79d,Health & Fitness,"rgb(155, 196, 78)"
On Purpose with Jay Shetty,5EqqB52m2bsr4k1Ii7sStc,"I’m Jay Shetty host of On Purpose the worlds #1 Mental Health podcast and I’m so grateful you found us. I started this podcast 5 years ago to invite you into conversations and workshops that are designed to help make you happier, healthier and more healed. I believe that when you (yes you) feel seen, heard and understood you’re able to deal with relationship struggles, work challenges and life’s ups and downs with more ease and grace. I interview experts, celebrities, thought leaders and athletes so that we can grow our mindset, build better habits and uncover a side of them we’ve never seen before. New episodes every Monday and Friday. Your support means the world to me and I don’t take it for granted — click the follow button and leave a review to help us spread the love with On Purpose. I can’t wait for you to listen to your first or 500th episode!",iHeartPodcasts,605,False,https://open.spotify.com/show/5EqqB52m2bsr4k1Ii7sStc,https://i.scdn.co/image/ab6765630000ba8a5fb5daaee522acf4307d98e2,Health & Fitness,"rgb(173, 130, 95)"
The Psychology of your 20s,2HGcJRYrjGnpce6bRp8UXm,"A podcast that explains how everything is psychology. Even your 20s. Hosted by Jemma Sbeg, each Tuesday and Friday we deep dive into the science and psychology behind a topic, concept or universal experience that defines our 20s - from dating, to mental health, career anxiety, friendship, finances and all the growing pains associated with this decade. Listen now.    For business enquires please email psychologyofyour20s@gmail.com New merchandise here: https://the-psychology-of-your-20s.myshopify.com/ ",iHeartPodcasts,247,False,https://open.spotify.com/show/2HGcJRYrjGnpce6bRp8UXm,https://i.scdn.co/image/ab6765630000ba8a2f4a7d19dc0bbf18680227b5,Health & Fitness,"rgb(255, 0, 0)"
Tony Mantor: Why Not Me the World,4dTv4Yxxf0WoM0fgBhv8XQ,"Autism is a complex neurodevelopmental condition that affects millions of people worldwide. It is characterized by difficulties in social interaction, communication, and repetitive behaviors. Although autism is becoming more widely recognized, there is still a lack of understanding and awareness surrounding the condition. As a result, many individuals and families affected by autism struggle to find the support and resources they need. Why Not Me The World podcast aims to bridge that gap by providing valuable information and insights into autism, fostering empathy and understanding, and promoting acceptance and inclusion. Nashville based Music Producer Tony Mantor explores the remarkable impact his guests make by empowering their voices in spreading awareness about autism and helping break down the barriers of understanding. Join Mantor and his guests as they delve into the world of autism and explore topics such as diagnosis, treatment, research, and personal stories. Together, we can create a more informed and compassionate society for individuals with autism. ",Tony Mantor,67,False,https://open.spotify.com/show/4dTv4Yxxf0WoM0fgBhv8XQ,https://i.scdn.co/image/ab6765630000ba8ad84e04ab73e8aa0d586e348f,Health & Fitness,"rgb(59, 180, 202)"
The Ultimate Human with Gary Brecka ,5Faf5ecAnYW7AzGdblqd6R,"Gary Brecka is a Human Biologist, biohacker, researcher, and an anti-aging and longevity expert. For over 20 years, he worked in the life insurance industry predicting mortality. After years and years of doing this type of research and analysis, he decided he wanted to spend the balance of his lifetime helping people live happier, healthier, longer, more fulfilling lives. In this weekly podcast, Gary has exciting conversations with celebrities, athletes, entrepreneurs, and scientists and is thrilled to share their transformative insights with you.   Link below for more info on Gary!",Gary Brecka,118,True,https://open.spotify.com/show/5Faf5ecAnYW7AzGdblqd6R,https://i.scdn.co/image/ab6765630000ba8ac4b1e016918275e3b8e2ba59,Health & Fitness,"rgb(179, 130, 117)"
The Dr. John Delony Show,3q3Uzj7jdndNfvKlMXuN9J,"The Dr. John Delony Show is a caller-driven show that gives you real talk on relationships and mental health challenges. We want to talk to you! To send us your questions, leave a voicemail at 844-693-3291 or email askjohn@ramseysolutions.com.",Ramsey Network,676,False,https://open.spotify.com/show/3q3Uzj7jdndNfvKlMXuN9J,https://i.scdn.co/image/ab6765630000ba8a9ca2d427c6742cf3af3b47e9,Health & Fitness,"rgb(206, 96, 84)"
The Dr. Hyman Show,50MFhL6rItlnDDEStFMSPu,"Welcome to The Dr. Hyman Show, the groundbreaking podcast redefining health in America and empowering you to take ownership of your health. Hosted by Dr. Mark Hyman—this show tackles the most pressing issues of our time: chronic disease, mental health, food policy and controversy, prevention and recovery, and longevity. In an era where our food system fuels disease and outdated healthcare models fail to address root causes, Dr. Hyman delivers evidence-based insights and expert interviews to help you become the CEO of your own health—something your doctor isn’t doing. The Dr. Hyman Show goes beyond the headlines to reimagine a food and healthcare system that protects health, unburdens our economy from the weight of chronic disease, supports the environment, and secures a vibrant future for all Americans. Whether you’re looking for cutting-edge protocols to transform your health, strategies to combat the chronic disease epidemic, or deep conversations about how wellness intersects with food, politics, and the environment, this podcast is your trusted guide. Rethink disease, claim your health, and join the movement for a healthier nation—tune into The Dr. Hyman Show today!",Dr. Mark Hyman,982,False,https://open.spotify.com/show/50MFhL6rItlnDDEStFMSPu,https://i.scdn.co/image/ab6765630000ba8aa2c49f8becd803c5e0535950,Health & Fitness,"rgb(195, 137, 100)"
We're All Insane,6UtKJixvYC9QhBXcfo5MOg,"Guest based podcast centered around the lives, experiences, and difficult traumas of real life individuals.   If you have a unique story you'd like to share on We're All Insane, send a message to wereallinsanepodcast@gmail.com  Please contact weareallinsane@outloudtalent.com for any business inquiries!",Devorah Roloff,117,True,https://open.spotify.com/show/6UtKJixvYC9QhBXcfo5MOg,https://i.scdn.co/image/ab6765630000ba8a8723df38e2218aebf533bbed,Health & Fitness,"rgb(255, 0, 0)"
Culture Apothecary with Alex Clark,7M0C7cl5Fobejy7gbT5GB2,"‘Culture Apothecary with Alex Clark’ is a health and wellness podcast where each guest provides their own remedy to heal a sick culture - physically, emotionally, and spiritually. Apothecaries were the place where people would go for natural remedies, and Alex is restoring this concept by inviting expert guests every Monday and Thursday night at 6pm PST/9pm EST to share raw, unpasteurized truths! But that's not all...the last Monday of EVERY month will be a special solo episode with Alex called ‘Lobotomy Hour,’ where Alex gives unhinged and unapologetic rants, life updates, hot takes and more!",Turning Point USA,181,True,https://open.spotify.com/show/7M0C7cl5Fobejy7gbT5GB2,https://i.scdn.co/image/ab6765630000ba8a57b663f4217dff352616b19c,Health & Fitness,"rgb(180, 91, 111)"
10% Happier with Dan Harris,1CfW319UkBMVhCXfei8huv,"Dan Harris is a fidgety, skeptical journalist who had a panic attack on live national television, which led him to try something he otherwise never would have considered: meditation. He went on to write the bestselling book, 10% Happier. On this show, Dan talks with eminent meditation teachers, top scientists, and even the odd celebrity. Guests include everyone from His Holiness the Dalai Lama to Brené Brown to Karamo from Queer Eye. On some episodes, Dan ventures into the deep end of the pool, covering subjects such as enlightenment and psychedelics. On other episodes, it’s science-based techniques for issues such as anxiety, productivity, and relationships. Dan's approach is seemingly modest, but secretly radical: happiness is a skill you can train, just like working your bicep in the gym. Your progress may be incremental at first, but like any good investment, it compounds over time.New episodes come out every Monday, Wednesday, and Friday. Listen to 10% Happier on the Wondery App or wherever you listen to your podcasts. You can listen early and ad-free on Wondery+. Join Wondery+ in the Wondery App, Apple Podcasts or Spotify. Start your free trial by visiting https://wondery.com/links/ten-percent-happier-with-dan-harris now.",Ten Percent Happier,1034,False,https://open.spotify.com/show/1CfW319UkBMVhCXfei8huv,https://i.scdn.co/image/ab6765630000ba8ab6e099bf209d26ab7c20ab1c,Health & Fitness,"rgb(239, 79, 40)"
The Peter Attia Drive,63AWQmsSnFNFHUqnRAOFtD,"Expert insight on health, performance, longevity, critical thinking, and pursuing excellence. Dr. Peter Attia (Stanford/Hopkins/NIH-trained MD) talks with leaders in their fields.","Peter Attia, MD",375,False,https://open.spotify.com/show/63AWQmsSnFNFHUqnRAOFtD,https://i.scdn.co/image/ab6765630000ba8a18d340f49db83ad1ec3020f0,Health & Fitness,"rgb(138, 167, 211)"
The School of Greatness,07GQhOZboEZOE1ysnFLipT,"Lewis Howes is a New York Times best-selling author, 2x All-American athlete, keynote speaker, and entrepreneur. The School of Greatness shares inspiring interviews from the most successful people on the planet—world-renowned leaders in business, entertainment, sports, science, health, and literature—to inspire YOU to unlock your inner greatness and live your best life.",Lewis Howes,1707,False,https://open.spotify.com/show/07GQhOZboEZOE1ysnFLipT,https://i.scdn.co/image/ab6765630000ba8ac17007bce624ac60be4e407d,Health & Fitness,"rgb(227, 146, 109)"
